C1: 106兒樂(六上)上傳進度統計總表(一) | L1: https://www.facebook.com/groups/110935385949398/permalink/495344620841804/
A4: 口風琴的使用方式 | D4: 節拍器的使用方式 | G4: 口風琴的清潔方式 | J4: 畢業生花圈的製作
A6: 鐵琴搬運的細節 | D6: 風琴搬運的細節 | G6: 定音鼓搬運的細節 | J6: 馬林巴搬運的細節
A8: 製表日期:2017/8/5 | I8: =第7、8週上傳功課!I3 -> 更新日期:2017/10/21 22:30
A9: 已經通過人數 | D9: =43-D10 -> 43 | E9: =43-E10 -> 43 | F9: =43-F10 -> 43 | G9: =43-G10 -> 42 | H9: =43-H10 -> 42 | I9: =43-I10 -> 30 | J9: =43-J10 -> 2 | K9: =43-K10 -> 0
A10: 尚未通過人數 | D10: =IF(LEN(D13&D14&D15&D16&D17&D18&D19&D20&D21&D22&D23&D24&D25&D26&D27&D28&D29&D30&D31&D32&D33&D34&D35&D36&D37&D38&D39&D40&D41&D42&D43&D44&D45&D46&D47&D48&D49&D50&D51&D52&D53&D54&D55)-LEN(SUBSTITUTE(D13&D14&D15&D16&D17&D18&D19&D20&D21&D22&D23&D24&D25&D26&D27&D28&D29&D30&D31&D32&D33&D34&D35&D36&D37&D38&D39&D40&D41&D42&D43&D44&D45&D46&D47&D48&D49&D50&D51&D52&D53&D54&D55,"X",""))>0,LEN(D13&D14&D15&D16&D17&D18&D19&D20&D21&D22&D23&D24&D25&D26&D27&D28&D29&D30&D31&D32&D33&D34&D35&D36&D37&D38&D39&D40&D41&D42&D43&D44&D45&D46&D47&D48&D49&D50&D51&D52&D53&D54&D55)-LEN(SUBSTITUTE(D13&D14&D15&D16&D17&D18&D19&D20&D21&D22&D23&D24&D25&D26&D27&D28&D29&D30&D31&D32&D33&D34&D35&D36&D37&D38&D39&D40&D41&D42&D43&D44&D45&D46&D47&D48&D49&D50&D51&D52&D53&D54&D55,"X","")),"0") -> 0 | E10: =IF(LEN(E13&E14&E15&E16&E17&E18&E19&E20&E21&E22&E23&E24&E25&E26&E27&E28&E29&E30&E31&E32&E33&E34&E35&E36&E37&E38&E39&E40&E41&E42&E43&E44&E45&E46&E47&E48&E49&E50&E51&E52&E53&E54&E55)-LEN(SUBSTITUTE(E13&E14&E15&E16&E17&E18&E19&E20&E21&E22&E23&E24&E25&E26&E27&E28&E29&E30&E31&E32&E33&E34&E35&E36&E37&E38&E39&E40&E41&E42&E43&E44&E45&E46&E47&E48&E49&E50&E51&E52&E53&E54&E55,"X",""))>0,LEN(E13&E14&E15&E16&E17&E18&E19&E20&E21&E22&E23&E24&E25&E26&E27&E28&E29&E30&E31&E32&E33&E34&E35&E36&E37&E38&E39&E40&E41&E42&E43&E44&E45&E46&E47&E48&E49&E50&E51&E52&E53&E54&E55)-LEN(SUBSTITUTE(E13&E14&E15&E16&E17&E18&E19&E20&E21&E22&E23&E24&E25&E26&E27&E28&E29&E30&E31&E32&E33&E34&E35&E36&E37&E38&E39&E40&E41&E42&E43&E44&E45&E46&E47&E48&E49&E50&E51&E52&E53&E54&E55,"X","")),"0") -> 0 | F10: =IF(LEN(F13&F14&F15&F16&F17&F18&F19&F20&F21&F22&F23&F24&F25&F26&F27&F28&F29&F30&F31&F32&F33&F34&F35&F36&F37&F38&F39&F40&F41&F42&F43&F44&F45&F46&F47&F48&F49&F50&F51&F52&F53&F54&F55)-LEN(SUBSTITUTE(F13&F14&F15&F16&F17&F18&F19&F20&F21&F22&F23&F24&F25&F26&F27&F28&F29&F30&F31&F32&F33&F34&F35&F36&F37&F38&F39&F40&F41&F42&F43&F44&F45&F46&F47&F48&F49&F50&F51&F52&F53&F54&F55,"X",""))>0,LEN(F13&F14&F15&F16&F17&F18&F19&F20&F21&F22&F23&F24&F25&F26&F27&F28&F29&F30&F31&F32&F33&F34&F35&F36&F37&F38&F39&F40&F41&F42&F43&F44&F45&F46&F47&F48&F49&F50&F51&F52&F53&F54&F55)-LEN(SUBSTITUTE(F13&F14&F15&F16&F17&F18&F19&F20&F21&F22&F23&F24&F25&F26&F27&F28&F29&F30&F31&F32&F33&F34&F35&F36&F37&F38&F39&F40&F41&F42&F43&F44&F45&F46&F47&F48&F49&F50&F51&F52&F53&F54&F55,"X","")),"0") -> 0 | G10: =IF(LEN(G13&G14&G15&G16&G17&G18&G19&G20&G21&G22&G23&G24&G25&G26&G27&G28&G29&G30&G31&G32&G33&G34&G35&G36&G37&G38&G39&G40&G41&G42&G43&G44&G45&G46&G47&G48&G49&G50&G51&G52&G53&G54&G55)-LEN(SUBSTITUTE(G13&G14&G15&G16&G17&G18&G19&G20&G21&G22&G23&G24&G25&G26&G27&G28&G29&G30&G31&G32&G33&G34&G35&G36&G37&G38&G39&G40&G41&G42&G43&G44&G45&G46&G47&G48&G49&G50&G51&G52&G53&G54&G55,"X",""))>0,LEN(G13&G14&G15&G16&G17&G18&G19&G20&G21&G22&G23&G24&G25&G26&G27&G28&G29&G30&G31&G32&G33&G34&G35&G36&G37&G38&G39&G40&G41&G42&G43&G44&G45&G46&G47&G48&G49&G50&G51&G52&G53&G54&G55)-LEN(SUBSTITUTE(G13&G14&G15&G16&G17&G18&G19&G20&G21&G22&G23&G24&G25&G26&G27&G28&G29&G30&G31&G32&G33&G34&G35&G36&G37&G38&G39&G40&G41&G42&G43&G44&G45&G46&G47&G48&G49&G50&G51&G52&G53&G54&G55,"X","")),"0") -> 1 | H10: =IF(LEN(H13&H14&H15&H16&H17&H18&H19&H20&H21&H22&H23&H24&H25&H26&H27&H28&H29&H30&H31&H32&H33&H34&H35&H36&H37&H38&H39&H40&H41&H42&H43&H44&H45&H46&H47&H48&H49&H50&H51&H52&H53&H54&H55)-LEN(SUBSTITUTE(H13&H14&H15&H16&H17&H18&H19&H20&H21&H22&H23&H24&H25&H26&H27&H28&H29&H30&H31&H32&H33&H34&H35&H36&H37&H38&H39&H40&H41&H42&H43&H44&H45&H46&H47&H48&H49&H50&H51&H52&H53&H54&H55,"X",""))>0,LEN(H13&H14&H15&H16&H17&H18&H19&H20&H21&H22&H23&H24&H25&H26&H27&H28&H29&H30&H31&H32&H33&H34&H35&H36&H37&H38&H39&H40&H41&H42&H43&H44&H45&H46&H47&H48&H49&H50&H51&H52&H53&H54&H55)-LEN(SUBSTITUTE(H13&H14&H15&H16&H17&H18&H19&H20&H21&H22&H23&H24&H25&H26&H27&H28&H29&H30&H31&H32&H33&H34&H35&H36&H37&H38&H39&H40&H41&H42&H43&H44&H45&H46&H47&H48&H49&H50&H51&H52&H53&H54&H55,"X","")),"0") -> 1 | I10: =IF(LEN(I13&I14&I15&I16&I17&I18&I19&I20&I21&I22&I23&I24&I25&I26&I27&I28&I29&I30&I31&I32&I33&I34&I35&I36&I37&I38&I39&I40&I41&I42&I43&I44&I45&I46&I47&I48&I49&I50&I51&I52&I53&I54&I55)-LEN(SUBSTITUTE(I13&I14&I15&I16&I17&I18&I19&I20&I21&I22&I23&I24&I25&I26&I27&I28&I29&I30&I31&I32&I33&I34&I35&I36&I37&I38&I39&I40&I41&I42&I43&I44&I45&I46&I47&I48&I49&I50&I51&I52&I53&I54&I55,"X",""))>0,LEN(I13&I14&I15&I16&I17&I18&I19&I20&I21&I22&I23&I24&I25&I26&I27&I28&I29&I30&I31&I32&I33&I34&I35&I36&I37&I38&I39&I40&I41&I42&I43&I44&I45&I46&I47&I48&I49&I50&I51&I52&I53&I54&I55)-LEN(SUBSTITUTE(I13&I14&I15&I16&I17&I18&I19&I20&I21&I22&I23&I24&I25&I26&I27&I28&I29&I30&I31&I32&I33&I34&I35&I36&I37&I38&I39&I40&I41&I42&I43&I44&I45&I46&I47&I48&I49&I50&I51&I52&I53&I54&I55,"X","")),"0") -> 13 | J10: =IF(LEN(J13&J14&J15&J16&J17&J18&J19&J20&J21&J22&J23&J24&J25&J26&J27&J28&J29&J30&J31&J32&J33&J34&J35&J36&J37&J38&J39&J40&J41&J42&J43&J44&J45&J46&J47&J48&J49&J50&J51&J52&J53&J54&J55)-LEN(SUBSTITUTE(J13&J14&J15&J16&J17&J18&J19&J20&J21&J22&J23&J24&J25&J26&J27&J28&J29&J30&J31&J32&J33&J34&J35&J36&J37&J38&J39&J40&J41&J42&J43&J44&J45&J46&J47&J48&J49&J50&J51&J52&J53&J54&J55,"X",""))>0,LEN(J13&J14&J15&J16&J17&J18&J19&J20&J21&J22&J23&J24&J25&J26&J27&J28&J29&J30&J31&J32&J33&J34&J35&J36&J37&J38&J39&J40&J41&J42&J43&J44&J45&J46&J47&J48&J49&J50&J51&J52&J53&J54&J55)-LEN(SUBSTITUTE(J13&J14&J15&J16&J17&J18&J19&J20&J21&J22&J23&J24&J25&J26&J27&J28&J29&J30&J31&J32&J33&J34&J35&J36&J37&J38&J39&J40&J41&J42&J43&J44&J45&J46&J47&J48&J49&J50&J51&J52&J53&J54&J55,"X","")),"0") -> 41 | K10: =IF(LEN(K13&K14&K15&K16&K17&K18&K19&K20&K21&K22&K23&K24&K25&K26&K27&K28&K29&K30&K31&K32&K33&K34&K35&K36&K37&K38&K39&K40&K41&K42&K43&K44&K45&K46&K47&K48&K49&K50&K51&K52&K53&K54&K55)-LEN(SUBSTITUTE(K13&K14&K15&K16&K17&K18&K19&K20&K21&K22&K23&K24&K25&K26&K27&K28&K29&K30&K31&K32&K33&K34&K35&K36&K37&K38&K39&K40&K41&K42&K43&K44&K45&K46&K47&K48&K49&K50&K51&K52&K53&K54&K55,"X",""))>0,LEN(K13&K14&K15&K16&K17&K18&K19&K20&K21&K22&K23&K24&K25&K26&K27&K28&K29&K30&K31&K32&K33&K34&K35&K36&K37&K38&K39&K40&K41&K42&K43&K44&K45&K46&K47&K48&K49&K50&K51&K52&K53&K54&K55)-LEN(SUBSTITUTE(K13&K14&K15&K16&K17&K18&K19&K20&K21&K22&K23&K24&K25&K26&K27&K28&K29&K30&K31&K32&K33&K34&K35&K36&K37&K38&K39&K40&K41&K42&K43&K44&K45&K46&K47&K48&K49&K50&K51&K52&K53&K54&K55,"X","")),"0") -> 43
A11: 編號 | B11: 班級 | C11: 姓名 | D11: 第1、2週上傳功課 | E11: 莫札特 小夜曲 Part 1 | F11: 莫札特 小夜曲 Part 2 | G11: 第3、4週上傳功課 | H11: 第5、6週上傳功課 | I11: 第7、8週上傳功課 | J11: 第9、10週上傳功課 | K11: Sheet4
A13: 1 | B13: 601 | C13: 李昱賢 | D13: =IF(第1、2週上傳功課!F6="○","○",IF(第1、2週上傳功課!$F6="△","○",IF(第1、2週上傳功課!$H6="○","○",IF(第1、2週上傳功課!$H6="△","○","X")))) -> ○ | E13: =IF('莫札特小夜曲 Part 1'!E6="○","○",IF('莫札特小夜曲 Part 1'!E6="△","○",IF('莫札特小夜曲 Part 1'!E6="☆","○",IF('莫札特小夜曲 Part 1'!H6="○","○",IF('莫札特小夜曲 Part 1'!H6="☆","○",IF('莫札特小夜曲 Part 1'!H6="△","○","X")))))) -> ○ | F13: =IF('莫札特小夜曲 Part 2'!E6="○","○",IF('莫札特小夜曲 Part 2'!E6="△","○",IF('莫札特小夜曲 Part 2'!E6="☆","○",IF('莫札特小夜曲 Part 2'!H6="○","○",IF('莫札特小夜曲 Part 2'!H6="☆","○",IF('莫札特小夜曲 Part 2'!H6="△","○","X")))))) -> ○ | G13: =IF(第3、4週上傳功課!F6="○","○",IF(第3、4週上傳功課!$F6="△","○",IF(第3、4週上傳功課!$H6="○","○",IF(第3、4週上傳功課!$H6="△","○","X")))) -> ○ | H13: =IF(第5、6週上傳功課!F6="○","○",IF(第5、6週上傳功課!$F6="△","○",IF(第5、6週上傳功課!$H6="○","○",IF(第5、6週上傳功課!$H6="△","○","X")))) -> ○ | I13: =IF(第7、8週上傳功課!F6="○","○",IF(第7、8週上傳功課!$F6="△","○",IF(第7、8週上傳功課!$H6="○","○",IF(第7、8週上傳功課!$H6="△","○","X")))) -> X | J13: =IF(第9、10週上傳功課!F6="○","○",IF(第9、10週上傳功課!$F6="△","○",IF(第9、10週上傳功課!$H6="○","○",IF(第9、10週上傳功課!$H6="△","○","X")))) -> X | K13: =IF(Sheet4!H6="○","○",IF(Sheet4!H6="△","○",IF(Sheet4!H6="☆","○",IF(Sheet4!K6="○","○",IF(Sheet4!K6="☆","○",IF(Sheet4!K6="△","○","X")))))) -> X
A14: 2 | B14: 601 | C14: 柯昱安 | D14: =IF(第1、2週上傳功課!F7="○","○",IF(第1、2週上傳功課!$F7="△","○",IF(第1、2週上傳功課!$H7="○","○",IF(第1、2週上傳功課!$H7="△","○","X")))) -> ○ | E14: =IF('莫札特小夜曲 Part 1'!E7="○","○",IF('莫札特小夜曲 Part 1'!E7="△","○",IF('莫札特小夜曲 Part 1'!E7="☆","○",IF('莫札特小夜曲 Part 1'!H7="○","○",IF('莫札特小夜曲 Part 1'!H7="☆","○",IF('莫札特小夜曲 Part 1'!H7="△","○","X")))))) -> ○ | F14: =IF('莫札特小夜曲 Part 2'!E7="○","○",IF('莫札特小夜曲 Part 2'!E7="△","○",IF('莫札特小夜曲 Part 2'!E7="☆","○",IF('莫札特小夜曲 Part 2'!H7="○","○",IF('莫札特小夜曲 Part 2'!H7="☆","○",IF('莫札特小夜曲 Part 2'!H7="△","○","X")))))) -> ○ | G14: =IF(第3、4週上傳功課!F7="○","○",IF(第3、4週上傳功課!$F7="△","○",IF(第3、4週上傳功課!$H7="○","○",IF(第3、4週上傳功課!$H7="△","○","X")))) -> ○ | H14: =IF(第5、6週上傳功課!F7="○","○",IF(第5、6週上傳功課!$F7="△","○",IF(第5、6週上傳功課!$H7="○","○",IF(第5、6週上傳功課!$H7="△","○","X")))) -> ○ | I14: =IF(第7、8週上傳功課!F7="○","○",IF(第7、8週上傳功課!$F7="△","○",IF(第7、8週上傳功課!$H7="○","○",IF(第7、8週上傳功課!$H7="△","○","X")))) -> ○ | J14: =IF(第9、10週上傳功課!F7="○","○",IF(第9、10週上傳功課!$F7="△","○",IF(第9、10週上傳功課!$H7="○","○",IF(第9、10週上傳功課!$H7="△","○","X")))) -> X | K14: =IF(Sheet4!H7="○","○",IF(Sheet4!H7="△","○",IF(Sheet4!H7="☆","○",IF(Sheet4!K7="○","○",IF(Sheet4!K7="☆","○",IF(Sheet4!K7="△","○","X")))))) -> X
A15: 3 | B15: 601 | C15: 吳芃葳 | D15: =IF(第1、2週上傳功課!F8="○","○",IF(第1、2週上傳功課!$F8="△","○",IF(第1、2週上傳功課!$H8="○","○",IF(第1、2週上傳功課!$H8="△","○","X")))) -> ○ | E15: =IF('莫札特小夜曲 Part 1'!E8="○","○",IF('莫札特小夜曲 Part 1'!E8="△","○",IF('莫札特小夜曲 Part 1'!E8="☆","○",IF('莫札特小夜曲 Part 1'!H8="○","○",IF('莫札特小夜曲 Part 1'!H8="☆","○",IF('莫札特小夜曲 Part 1'!H8="△","○","X")))))) -> ○ | F15: =IF('莫札特小夜曲 Part 2'!E8="○","○",IF('莫札特小夜曲 Part 2'!E8="△","○",IF('莫札特小夜曲 Part 2'!E8="☆","○",IF('莫札特小夜曲 Part 2'!H8="○","○",IF('莫札特小夜曲 Part 2'!H8="☆","○",IF('莫札特小夜曲 Part 2'!H8="△","○","X")))))) -> ○ | G15: =IF(第3、4週上傳功課!F8="○","○",IF(第3、4週上傳功課!$F8="△","○",IF(第3、4週上傳功課!$H8="○","○",IF(第3、4週上傳功課!$H8="△","○","X")))) -> ○ | H15: =IF(第5、6週上傳功課!F8="○","○",IF(第5、6週上傳功課!$F8="△","○",IF(第5、6週上傳功課!$H8="○","○",IF(第5、6週上傳功課!$H8="△","○","X")))) -> ○ | I15: =IF(第7、8週上傳功課!F8="○","○",IF(第7、8週上傳功課!$F8="△","○",IF(第7、8週上傳功課!$H8="○","○",IF(第7、8週上傳功課!$H8="△","○","X")))) -> X | J15: =IF(第9、10週上傳功課!F8="○","○",IF(第9、10週上傳功課!$F8="△","○",IF(第9、10週上傳功課!$H8="○","○",IF(第9、10週上傳功課!$H8="△","○","X")))) -> X | K15: =IF(Sheet4!H8="○","○",IF(Sheet4!H8="△","○",IF(Sheet4!H8="☆","○",IF(Sheet4!K8="○","○",IF(Sheet4!K8="☆","○",IF(Sheet4!K8="△","○","X")))))) -> X
A16: 4 | B16: 601 | C16: 張芷綾 | D16: =IF(第1、2週上傳功課!F9="○","○",IF(第1、2週上傳功課!$F9="△","○",IF(第1、2週上傳功課!$H9="○","○",IF(第1、2週上傳功課!$H9="△","○","X")))) -> ○ | E16: =IF('莫札特小夜曲 Part 1'!E9="○","○",IF('莫札特小夜曲 Part 1'!E9="△","○",IF('莫札特小夜曲 Part 1'!E9="☆","○",IF('莫札特小夜曲 Part 1'!H9="○","○",IF('莫札特小夜曲 Part 1'!H9="☆","○",IF('莫札特小夜曲 Part 1'!H9="△","○","X")))))) -> ○ | F16: =IF('莫札特小夜曲 Part 2'!E9="○","○",IF('莫札特小夜曲 Part 2'!E9="△","○",IF('莫札特小夜曲 Part 2'!E9="☆","○",IF('莫札特小夜曲 Part 2'!H9="○","○",IF('莫札特小夜曲 Part 2'!H9="☆","○",IF('莫札特小夜曲 Part 2'!H9="△","○","X")))))) -> ○ | G16: =IF(第3、4週上傳功課!F9="○","○",IF(第3、4週上傳功課!$F9="△","○",IF(第3、4週上傳功課!$H9="○","○",IF(第3、4週上傳功課!$H9="△","○","X")))) -> ○ | H16: =IF(第5、6週上傳功課!F9="○","○",IF(第5、6週上傳功課!$F9="△","○",IF(第5、6週上傳功課!$H9="○","○",IF(第5、6週上傳功課!$H9="△","○","X")))) -> ○ | I16: =IF(第7、8週上傳功課!F9="○","○",IF(第7、8週上傳功課!$F9="△","○",IF(第7、8週上傳功課!$H9="○","○",IF(第7、8週上傳功課!$H9="△","○","X")))) -> X | J16: =IF(第9、10週上傳功課!F9="○","○",IF(第9、10週上傳功課!$F9="△","○",IF(第9、10週上傳功課!$H9="○","○",IF(第9、10週上傳功課!$H9="△","○","X")))) -> X | K16: =IF(Sheet4!H9="○","○",IF(Sheet4!H9="△","○",IF(Sheet4!H9="☆","○",IF(Sheet4!K9="○","○",IF(Sheet4!K9="☆","○",IF(Sheet4!K9="△","○","X")))))) -> X
A17: 5 | B17: 602 | C17: 王聖翔 | D17: =IF(第1、2週上傳功課!F10="○","○",IF(第1、2週上傳功課!$F10="△","○",IF(第1、2週上傳功課!$H10="○","○",IF(第1、2週上傳功課!$H10="△","○","X")))) -> ○ | E17: =IF('莫札特小夜曲 Part 1'!E10="○","○",IF('莫札特小夜曲 Part 1'!E10="△","○",IF('莫札特小夜曲 Part 1'!E10="☆","○",IF('莫札特小夜曲 Part 1'!H10="○","○",IF('莫札特小夜曲 Part 1'!H10="☆","○",IF('莫札特小夜曲 Part 1'!H10="△","○","X")))))) -> ○ | F17: =IF('莫札特小夜曲 Part 2'!E10="○","○",IF('莫札特小夜曲 Part 2'!E10="△","○",IF('莫札特小夜曲 Part 2'!E10="☆","○",IF('莫札特小夜曲 Part 2'!H10="○","○",IF('莫札特小夜曲 Part 2'!H10="☆","○",IF('莫札特小夜曲 Part 2'!H10="△","○","X")))))) -> ○ | G17: =IF(第3、4週上傳功課!F10="○","○",IF(第3、4週上傳功課!$F10="△","○",IF(第3、4週上傳功課!$H10="○","○",IF(第3、4週上傳功課!$H10="△","○","X")))) -> ○ | H17: =IF(第5、6週上傳功課!F10="○","○",IF(第5、6週上傳功課!$F10="△","○",IF(第5、6週上傳功課!$H10="○","○",IF(第5、6週上傳功課!$H10="△","○","X")))) -> ○ | I17: =IF(第7、8週上傳功課!F10="○","○",IF(第7、8週上傳功課!$F10="△","○",IF(第7、8週上傳功課!$H10="○","○",IF(第7、8週上傳功課!$H10="△","○","X")))) -> X | J17: =IF(第9、10週上傳功課!F10="○","○",IF(第9、10週上傳功課!$F10="△","○",IF(第9、10週上傳功課!$H10="○","○",IF(第9、10週上傳功課!$H10="△","○","X")))) -> X | K17: =IF(Sheet4!H10="○","○",IF(Sheet4!H10="△","○",IF(Sheet4!H10="☆","○",IF(Sheet4!K10="○","○",IF(Sheet4!K10="☆","○",IF(Sheet4!K10="△","○","X")))))) -> X
A18: 6 | B18: 602 | C18: 邱子歆 | D18: =IF(第1、2週上傳功課!F11="○","○",IF(第1、2週上傳功課!$F11="△","○",IF(第1、2週上傳功課!$H11="○","○",IF(第1、2週上傳功課!$H11="△","○","X")))) -> ○ | E18: =IF('莫札特小夜曲 Part 1'!E11="○","○",IF('莫札特小夜曲 Part 1'!E11="△","○",IF('莫札特小夜曲 Part 1'!E11="☆","○",IF('莫札特小夜曲 Part 1'!H11="○","○",IF('莫札特小夜曲 Part 1'!H11="☆","○",IF('莫札特小夜曲 Part 1'!H11="△","○","X")))))) -> ○ | F18: =IF('莫札特小夜曲 Part 2'!E11="○","○",IF('莫札特小夜曲 Part 2'!E11="△","○",IF('莫札特小夜曲 Part 2'!E11="☆","○",IF('莫札特小夜曲 Part 2'!H11="○","○",IF('莫札特小夜曲 Part 2'!H11="☆","○",IF('莫札特小夜曲 Part 2'!H11="△","○","X")))))) -> ○ | G18: =IF(第3、4週上傳功課!F11="○","○",IF(第3、4週上傳功課!$F11="△","○",IF(第3、4週上傳功課!$H11="○","○",IF(第3、4週上傳功課!$H11="△","○","X")))) -> ○ | H18: =IF(第5、6週上傳功課!F11="○","○",IF(第5、6週上傳功課!$F11="△","○",IF(第5、6週上傳功課!$H11="○","○",IF(第5、6週上傳功課!$H11="△","○","X")))) -> ○ | I18: =IF(第7、8週上傳功課!F11="○","○",IF(第7、8週上傳功課!$F11="△","○",IF(第7、8週上傳功課!$H11="○","○",IF(第7、8週上傳功課!$H11="△","○","X")))) -> ○ | J18: =IF(第9、10週上傳功課!F11="○","○",IF(第9、10週上傳功課!$F11="△","○",IF(第9、10週上傳功課!$H11="○","○",IF(第9、10週上傳功課!$H11="△","○","X")))) -> X | K18: =IF(Sheet4!H11="○","○",IF(Sheet4!H11="△","○",IF(Sheet4!H11="☆","○",IF(Sheet4!K11="○","○",IF(Sheet4!K11="☆","○",IF(Sheet4!K11="△","○","X")))))) -> X
A19: 7 | B19: 604 | C19: 蕭睿嫺 | D19: =IF(第1、2週上傳功課!F12="○","○",IF(第1、2週上傳功課!$F12="△","○",IF(第1、2週上傳功課!$H12="○","○",IF(第1、2週上傳功課!$H12="△","○","X")))) -> ○ | E19: =IF('莫札特小夜曲 Part 1'!E12="○","○",IF('莫札特小夜曲 Part 1'!E12="△","○",IF('莫札特小夜曲 Part 1'!E12="☆","○",IF('莫札特小夜曲 Part 1'!H12="○","○",IF('莫札特小夜曲 Part 1'!H12="☆","○",IF('莫札特小夜曲 Part 1'!H12="△","○","X")))))) -> ○ | F19: =IF('莫札特小夜曲 Part 2'!E12="○","○",IF('莫札特小夜曲 Part 2'!E12="△","○",IF('莫札特小夜曲 Part 2'!E12="☆","○",IF('莫札特小夜曲 Part 2'!H12="○","○",IF('莫札特小夜曲 Part 2'!H12="☆","○",IF('莫札特小夜曲 Part 2'!H12="△","○","X")))))) -> ○ | G19: =IF(第3、4週上傳功課!F12="○","○",IF(第3、4週上傳功課!$F12="△","○",IF(第3、4週上傳功課!$H12="○","○",IF(第3、4週上傳功課!$H12="△","○","X")))) -> ○ | H19: =IF(第5、6週上傳功課!F12="○","○",IF(第5、6週上傳功課!$F12="△","○",IF(第5、6週上傳功課!$H12="○","○",IF(第5、6週上傳功課!$H12="△","○","X")))) -> ○ | I19: =IF(第7、8週上傳功課!F12="○","○",IF(第7、8週上傳功課!$F12="△","○",IF(第7、8週上傳功課!$H12="○","○",IF(第7、8週上傳功課!$H12="△","○","X")))) -> ○ | J19: =IF(第9、10週上傳功課!F12="○","○",IF(第9、10週上傳功課!$F12="△","○",IF(第9、10週上傳功課!$H12="○","○",IF(第9、10週上傳功課!$H12="△","○","X")))) -> X | K19: =IF(Sheet4!H12="○","○",IF(Sheet4!H12="△","○",IF(Sheet4!H12="☆","○",IF(Sheet4!K12="○","○",IF(Sheet4!K12="☆","○",IF(Sheet4!K12="△","○","X")))))) -> X
A20: 8 | B20: 604 | C20: 林彤恩 | D20: =IF(第1、2週上傳功課!F13="○","○",IF(第1、2週上傳功課!$F13="△","○",IF(第1、2週上傳功課!$H13="○","○",IF(第1、2週上傳功課!$H13="△","○","X")))) -> ○ | E20: =IF('莫札特小夜曲 Part 1'!E13="○","○",IF('莫札特小夜曲 Part 1'!E13="△","○",IF('莫札特小夜曲 Part 1'!E13="☆","○",IF('莫札特小夜曲 Part 1'!H13="○","○",IF('莫札特小夜曲 Part 1'!H13="☆","○",IF('莫札特小夜曲 Part 1'!H13="△","○","X")))))) -> ○ | F20: =IF('莫札特小夜曲 Part 2'!E13="○","○",IF('莫札特小夜曲 Part 2'!E13="△","○",IF('莫札特小夜曲 Part 2'!E13="☆","○",IF('莫札特小夜曲 Part 2'!H13="○","○",IF('莫札特小夜曲 Part 2'!H13="☆","○",IF('莫札特小夜曲 Part 2'!H13="△","○","X")))))) -> ○ | G20: =IF(第3、4週上傳功課!F13="○","○",IF(第3、4週上傳功課!$F13="△","○",IF(第3、4週上傳功課!$H13="○","○",IF(第3、4週上傳功課!$H13="△","○","X")))) -> ○ | H20: =IF(第5、6週上傳功課!F13="○","○",IF(第5、6週上傳功課!$F13="△","○",IF(第5、6週上傳功課!$H13="○","○",IF(第5、6週上傳功課!$H13="△","○","X")))) -> ○ | I20: =IF(第7、8週上傳功課!F13="○","○",IF(第7、8週上傳功課!$F13="△","○",IF(第7、8週上傳功課!$H13="○","○",IF(第7、8週上傳功課!$H13="△","○","X")))) -> ○ | J20: =IF(第9、10週上傳功課!F13="○","○",IF(第9、10週上傳功課!$F13="△","○",IF(第9、10週上傳功課!$H13="○","○",IF(第9、10週上傳功課!$H13="△","○","X")))) -> X | K20: =IF(Sheet4!H13="○","○",IF(Sheet4!H13="△","○",IF(Sheet4!H13="☆","○",IF(Sheet4!K13="○","○",IF(Sheet4!K13="☆","○",IF(Sheet4!K13="△","○","X")))))) -> X
A21: 9 | B21: 604 | C21: 何品瑀 | D21: =IF(第1、2週上傳功課!F14="○","○",IF(第1、2週上傳功課!$F14="△","○",IF(第1、2週上傳功課!$H14="○","○",IF(第1、2週上傳功課!$H14="△","○","X")))) -> ○ | E21: =IF('莫札特小夜曲 Part 1'!E14="○","○",IF('莫札特小夜曲 Part 1'!E14="△","○",IF('莫札特小夜曲 Part 1'!E14="☆","○",IF('莫札特小夜曲 Part 1'!H14="○","○",IF('莫札特小夜曲 Part 1'!H14="☆","○",IF('莫札特小夜曲 Part 1'!H14="△","○","X")))))) -> ○ | F21: =IF('莫札特小夜曲 Part 2'!E14="○","○",IF('莫札特小夜曲 Part 2'!E14="△","○",IF('莫札特小夜曲 Part 2'!E14="☆","○",IF('莫札特小夜曲 Part 2'!H14="○","○",IF('莫札特小夜曲 Part 2'!H14="☆","○",IF('莫札特小夜曲 Part 2'!H14="△","○","X")))))) -> ○ | G21: =IF(第3、4週上傳功課!F14="○","○",IF(第3、4週上傳功課!$F14="△","○",IF(第3、4週上傳功課!$H14="○","○",IF(第3、4週上傳功課!$H14="△","○","X")))) -> ○ | H21: =IF(第5、6週上傳功課!F14="○","○",IF(第5、6週上傳功課!$F14="△","○",IF(第5、6週上傳功課!$H14="○","○",IF(第5、6週上傳功課!$H14="△","○","X")))) -> ○ | I21: =IF(第7、8週上傳功課!F14="○","○",IF(第7、8週上傳功課!$F14="△","○",IF(第7、8週上傳功課!$H14="○","○",IF(第7、8週上傳功課!$H14="△","○","X")))) -> ○ | J21: =IF(第9、10週上傳功課!F14="○","○",IF(第9、10週上傳功課!$F14="△","○",IF(第9、10週上傳功課!$H14="○","○",IF(第9、10週上傳功課!$H14="△","○","X")))) -> X | K21: =IF(Sheet4!H14="○","○",IF(Sheet4!H14="△","○",IF(Sheet4!H14="☆","○",IF(Sheet4!K14="○","○",IF(Sheet4!K14="☆","○",IF(Sheet4!K14="△","○","X")))))) -> X
A22: 10 | B22: 605 | C22: 陳莛媗 | D22: =IF(第1、2週上傳功課!F15="○","○",IF(第1、2週上傳功課!$F15="△","○",IF(第1、2週上傳功課!$H15="○","○",IF(第1、2週上傳功課!$H15="△","○","X")))) -> ○ | E22: =IF('莫札特小夜曲 Part 1'!E15="○","○",IF('莫札特小夜曲 Part 1'!E15="△","○",IF('莫札特小夜曲 Part 1'!E15="☆","○",IF('莫札特小夜曲 Part 1'!H15="○","○",IF('莫札特小夜曲 Part 1'!H15="☆","○",IF('莫札特小夜曲 Part 1'!H15="△","○","X")))))) -> ○ | F22: =IF('莫札特小夜曲 Part 2'!E15="○","○",IF('莫札特小夜曲 Part 2'!E15="△","○",IF('莫札特小夜曲 Part 2'!E15="☆","○",IF('莫札特小夜曲 Part 2'!H15="○","○",IF('莫札特小夜曲 Part 2'!H15="☆","○",IF('莫札特小夜曲 Part 2'!H15="△","○","X")))))) -> ○ | G22: =IF(第3、4週上傳功課!F15="○","○",IF(第3、4週上傳功課!$F15="△","○",IF(第3、4週上傳功課!$H15="○","○",IF(第3、4週上傳功課!$H15="△","○","X")))) -> ○ | H22: =IF(第5、6週上傳功課!F15="○","○",IF(第5、6週上傳功課!$F15="△","○",IF(第5、6週上傳功課!$H15="○","○",IF(第5、6週上傳功課!$H15="△","○","X")))) -> ○ | I22: =IF(第7、8週上傳功課!F15="○","○",IF(第7、8週上傳功課!$F15="△","○",IF(第7、8週上傳功課!$H15="○","○",IF(第7、8週上傳功課!$H15="△","○","X")))) -> X | J22: =IF(第9、10週上傳功課!F15="○","○",IF(第9、10週上傳功課!$F15="△","○",IF(第9、10週上傳功課!$H15="○","○",IF(第9、10週上傳功課!$H15="△","○","X")))) -> X | K22: =IF(Sheet4!H15="○","○",IF(Sheet4!H15="△","○",IF(Sheet4!H15="☆","○",IF(Sheet4!K15="○","○",IF(Sheet4!K15="☆","○",IF(Sheet4!K15="△","○","X")))))) -> X
A23: 11 | B23: 606 | C23: 詹睿宏 | D23: =IF(第1、2週上傳功課!F16="○","○",IF(第1、2週上傳功課!$F16="△","○",IF(第1、2週上傳功課!$H16="○","○",IF(第1、2週上傳功課!$H16="△","○","X")))) -> ○ | E23: =IF('莫札特小夜曲 Part 1'!E16="○","○",IF('莫札特小夜曲 Part 1'!E16="△","○",IF('莫札特小夜曲 Part 1'!E16="☆","○",IF('莫札特小夜曲 Part 1'!H16="○","○",IF('莫札特小夜曲 Part 1'!H16="☆","○",IF('莫札特小夜曲 Part 1'!H16="△","○","X")))))) -> ○ | F23: =IF('莫札特小夜曲 Part 2'!E16="○","○",IF('莫札特小夜曲 Part 2'!E16="△","○",IF('莫札特小夜曲 Part 2'!E16="☆","○",IF('莫札特小夜曲 Part 2'!H16="○","○",IF('莫札特小夜曲 Part 2'!H16="☆","○",IF('莫札特小夜曲 Part 2'!H16="△","○","X")))))) -> ○ | G23: =IF(第3、4週上傳功課!F16="○","○",IF(第3、4週上傳功課!$F16="△","○",IF(第3、4週上傳功課!$H16="○","○",IF(第3、4週上傳功課!$H16="△","○","X")))) -> ○ | H23: =IF(第5、6週上傳功課!F16="○","○",IF(第5、6週上傳功課!$F16="△","○",IF(第5、6週上傳功課!$H16="○","○",IF(第5、6週上傳功課!$H16="△","○","X")))) -> ○ | I23: =IF(第7、8週上傳功課!F16="○","○",IF(第7、8週上傳功課!$F16="△","○",IF(第7、8週上傳功課!$H16="○","○",IF(第7、8週上傳功課!$H16="△","○","X")))) -> X | J23: =IF(第9、10週上傳功課!F16="○","○",IF(第9、10週上傳功課!$F16="△","○",IF(第9、10週上傳功課!$H16="○","○",IF(第9、10週上傳功課!$H16="△","○","X")))) -> X | K23: =IF(Sheet4!H16="○","○",IF(Sheet4!H16="△","○",IF(Sheet4!H16="☆","○",IF(Sheet4!K16="○","○",IF(Sheet4!K16="☆","○",IF(Sheet4!K16="△","○","X")))))) -> X
A24: 12 | B24: 606 | C24: 呂育安 | D24: =IF(第1、2週上傳功課!F17="○","○",IF(第1、2週上傳功課!$F17="△","○",IF(第1、2週上傳功課!$H17="○","○",IF(第1、2週上傳功課!$H17="△","○","X")))) -> ○ | E24: =IF('莫札特小夜曲 Part 1'!E17="○","○",IF('莫札特小夜曲 Part 1'!E17="△","○",IF('莫札特小夜曲 Part 1'!E17="☆","○",IF('莫札特小夜曲 Part 1'!H17="○","○",IF('莫札特小夜曲 Part 1'!H17="☆","○",IF('莫札特小夜曲 Part 1'!H17="△","○","X")))))) -> ○ | F24: =IF('莫札特小夜曲 Part 2'!E17="○","○",IF('莫札特小夜曲 Part 2'!E17="△","○",IF('莫札特小夜曲 Part 2'!E17="☆","○",IF('莫札特小夜曲 Part 2'!H17="○","○",IF('莫札特小夜曲 Part 2'!H17="☆","○",IF('莫札特小夜曲 Part 2'!H17="△","○","X")))))) -> ○ | G24: =IF(第3、4週上傳功課!F17="○","○",IF(第3、4週上傳功課!$F17="△","○",IF(第3、4週上傳功課!$H17="○","○",IF(第3、4週上傳功課!$H17="△","○","X")))) -> ○ | H24: =IF(第5、6週上傳功課!F17="○","○",IF(第5、6週上傳功課!$F17="△","○",IF(第5、6週上傳功課!$H17="○","○",IF(第5、6週上傳功課!$H17="△","○","X")))) -> ○ | I24: =IF(第7、8週上傳功課!F17="○","○",IF(第7、8週上傳功課!$F17="△","○",IF(第7、8週上傳功課!$H17="○","○",IF(第7、8週上傳功課!$H17="△","○","X")))) -> ○ | J24: =IF(第9、10週上傳功課!F17="○","○",IF(第9、10週上傳功課!$F17="△","○",IF(第9、10週上傳功課!$H17="○","○",IF(第9、10週上傳功課!$H17="△","○","X")))) -> X | K24: =IF(Sheet4!H17="○","○",IF(Sheet4!H17="△","○",IF(Sheet4!H17="☆","○",IF(Sheet4!K17="○","○",IF(Sheet4!K17="☆","○",IF(Sheet4!K17="△","○","X")))))) -> X
A25: 13 | B25: 606 | C25: 周子郡 | D25: =IF(第1、2週上傳功課!F18="○","○",IF(第1、2週上傳功課!$F18="△","○",IF(第1、2週上傳功課!$H18="○","○",IF(第1、2週上傳功課!$H18="△","○","X")))) -> ○ | E25: =IF('莫札特小夜曲 Part 1'!E18="○","○",IF('莫札特小夜曲 Part 1'!E18="△","○",IF('莫札特小夜曲 Part 1'!E18="☆","○",IF('莫札特小夜曲 Part 1'!H18="○","○",IF('莫札特小夜曲 Part 1'!H18="☆","○",IF('莫札特小夜曲 Part 1'!H18="△","○","X")))))) -> ○ | F25: =IF('莫札特小夜曲 Part 2'!E18="○","○",IF('莫札特小夜曲 Part 2'!E18="△","○",IF('莫札特小夜曲 Part 2'!E18="☆","○",IF('莫札特小夜曲 Part 2'!H18="○","○",IF('莫札特小夜曲 Part 2'!H18="☆","○",IF('莫札特小夜曲 Part 2'!H18="△","○","X")))))) -> ○ | G25: =IF(第3、4週上傳功課!F18="○","○",IF(第3、4週上傳功課!$F18="△","○",IF(第3、4週上傳功課!$H18="○","○",IF(第3、4週上傳功課!$H18="△","○","X")))) -> ○ | H25: =IF(第5、6週上傳功課!F18="○","○",IF(第5、6週上傳功課!$F18="△","○",IF(第5、6週上傳功課!$H18="○","○",IF(第5、6週上傳功課!$H18="△","○","X")))) -> ○ | I25: =IF(第7、8週上傳功課!F18="○","○",IF(第7、8週上傳功課!$F18="△","○",IF(第7、8週上傳功課!$H18="○","○",IF(第7、8週上傳功課!$H18="△","○","X")))) -> ○ | J25: =IF(第9、10週上傳功課!F18="○","○",IF(第9、10週上傳功課!$F18="△","○",IF(第9、10週上傳功課!$H18="○","○",IF(第9、10週上傳功課!$H18="△","○","X")))) -> X | K25: =IF(Sheet4!H18="○","○",IF(Sheet4!H18="△","○",IF(Sheet4!H18="☆","○",IF(Sheet4!K18="○","○",IF(Sheet4!K18="☆","○",IF(Sheet4!K18="△","○","X")))))) -> X
A26: 14 | B26: 606 | C26: 卓伶 | D26: =IF(第1、2週上傳功課!F19="○","○",IF(第1、2週上傳功課!$F19="△","○",IF(第1、2週上傳功課!$H19="○","○",IF(第1、2週上傳功課!$H19="△","○","X")))) -> ○ | E26: =IF('莫札特小夜曲 Part 1'!E19="○","○",IF('莫札特小夜曲 Part 1'!E19="△","○",IF('莫札特小夜曲 Part 1'!E19="☆","○",IF('莫札特小夜曲 Part 1'!H19="○","○",IF('莫札特小夜曲 Part 1'!H19="☆","○",IF('莫札特小夜曲 Part 1'!H19="△","○","X")))))) -> ○ | F26: =IF('莫札特小夜曲 Part 2'!E19="○","○",IF('莫札特小夜曲 Part 2'!E19="△","○",IF('莫札特小夜曲 Part 2'!E19="☆","○",IF('莫札特小夜曲 Part 2'!H19="○","○",IF('莫札特小夜曲 Part 2'!H19="☆","○",IF('莫札特小夜曲 Part 2'!H19="△","○","X")))))) -> ○ | G26: =IF(第3、4週上傳功課!F19="○","○",IF(第3、4週上傳功課!$F19="△","○",IF(第3、4週上傳功課!$H19="○","○",IF(第3、4週上傳功課!$H19="△","○","X")))) -> ○ | H26: =IF(第5、6週上傳功課!F19="○","○",IF(第5、6週上傳功課!$F19="△","○",IF(第5、6週上傳功課!$H19="○","○",IF(第5、6週上傳功課!$H19="△","○","X")))) -> ○ | I26: =IF(第7、8週上傳功課!F19="○","○",IF(第7、8週上傳功課!$F19="△","○",IF(第7、8週上傳功課!$H19="○","○",IF(第7、8週上傳功課!$H19="△","○","X")))) -> ○ | J26: =IF(第9、10週上傳功課!F19="○","○",IF(第9、10週上傳功課!$F19="△","○",IF(第9、10週上傳功課!$H19="○","○",IF(第9、10週上傳功課!$H19="△","○","X")))) -> X | K26: =IF(Sheet4!H19="○","○",IF(Sheet4!H19="△","○",IF(Sheet4!H19="☆","○",IF(Sheet4!K19="○","○",IF(Sheet4!K19="☆","○",IF(Sheet4!K19="△","○","X")))))) -> X
A27: 15 | B27: 606 | C27: 魏采悠 | D27: =IF(第1、2週上傳功課!F20="○","○",IF(第1、2週上傳功課!$F20="△","○",IF(第1、2週上傳功課!$H20="○","○",IF(第1、2週上傳功課!$H20="△","○","X")))) -> ○ | E27: =IF('莫札特小夜曲 Part 1'!E20="○","○",IF('莫札特小夜曲 Part 1'!E20="△","○",IF('莫札特小夜曲 Part 1'!E20="☆","○",IF('莫札特小夜曲 Part 1'!H20="○","○",IF('莫札特小夜曲 Part 1'!H20="☆","○",IF('莫札特小夜曲 Part 1'!H20="△","○","X")))))) -> ○ | F27: =IF('莫札特小夜曲 Part 2'!E20="○","○",IF('莫札特小夜曲 Part 2'!E20="△","○",IF('莫札特小夜曲 Part 2'!E20="☆","○",IF('莫札特小夜曲 Part 2'!H20="○","○",IF('莫札特小夜曲 Part 2'!H20="☆","○",IF('莫札特小夜曲 Part 2'!H20="△","○","X")))))) -> ○ | G27: =IF(第3、4週上傳功課!F20="○","○",IF(第3、4週上傳功課!$F20="△","○",IF(第3、4週上傳功課!$H20="○","○",IF(第3、4週上傳功課!$H20="△","○","X")))) -> ○ | H27: =IF(第5、6週上傳功課!F20="○","○",IF(第5、6週上傳功課!$F20="△","○",IF(第5、6週上傳功課!$H20="○","○",IF(第5、6週上傳功課!$H20="△","○","X")))) -> ○ | I27: =IF(第7、8週上傳功課!F20="○","○",IF(第7、8週上傳功課!$F20="△","○",IF(第7、8週上傳功課!$H20="○","○",IF(第7、8週上傳功課!$H20="△","○","X")))) -> ○ | J27: =IF(第9、10週上傳功課!F20="○","○",IF(第9、10週上傳功課!$F20="△","○",IF(第9、10週上傳功課!$H20="○","○",IF(第9、10週上傳功課!$H20="△","○","X")))) -> X | K27: =IF(Sheet4!H20="○","○",IF(Sheet4!H20="△","○",IF(Sheet4!H20="☆","○",IF(Sheet4!K20="○","○",IF(Sheet4!K20="☆","○",IF(Sheet4!K20="△","○","X")))))) -> X
A28: 16 | B28: 607 | C28: 許洵睿 | D28: =IF(第1、2週上傳功課!F21="○","○",IF(第1、2週上傳功課!$F21="△","○",IF(第1、2週上傳功課!$H21="○","○",IF(第1、2週上傳功課!$H21="△","○","X")))) -> ○ | E28: =IF('莫札特小夜曲 Part 1'!E21="○","○",IF('莫札特小夜曲 Part 1'!E21="△","○",IF('莫札特小夜曲 Part 1'!E21="☆","○",IF('莫札特小夜曲 Part 1'!H21="○","○",IF('莫札特小夜曲 Part 1'!H21="☆","○",IF('莫札特小夜曲 Part 1'!H21="△","○","X")))))) -> ○ | F28: =IF('莫札特小夜曲 Part 2'!E21="○","○",IF('莫札特小夜曲 Part 2'!E21="△","○",IF('莫札特小夜曲 Part 2'!E21="☆","○",IF('莫札特小夜曲 Part 2'!H21="○","○",IF('莫札特小夜曲 Part 2'!H21="☆","○",IF('莫札特小夜曲 Part 2'!H21="△","○","X")))))) -> ○ | G28: =IF(第3、4週上傳功課!F21="○","○",IF(第3、4週上傳功課!$F21="△","○",IF(第3、4週上傳功課!$H21="○","○",IF(第3、4週上傳功課!$H21="△","○","X")))) -> ○ | H28: =IF(第5、6週上傳功課!F21="○","○",IF(第5、6週上傳功課!$F21="△","○",IF(第5、6週上傳功課!$H21="○","○",IF(第5、6週上傳功課!$H21="△","○","X")))) -> ○ | I28: =IF(第7、8週上傳功課!F21="○","○",IF(第7、8週上傳功課!$F21="△","○",IF(第7、8週上傳功課!$H21="○","○",IF(第7、8週上傳功課!$H21="△","○","X")))) -> ○ | J28: =IF(第9、10週上傳功課!F21="○","○",IF(第9、10週上傳功課!$F21="△","○",IF(第9、10週上傳功課!$H21="○","○",IF(第9、10週上傳功課!$H21="△","○","X")))) -> X | K28: =IF(Sheet4!H21="○","○",IF(Sheet4!H21="△","○",IF(Sheet4!H21="☆","○",IF(Sheet4!K21="○","○",IF(Sheet4!K21="☆","○",IF(Sheet4!K21="△","○","X")))))) -> X
A29: 17 | B29: 607 | C29: 陳知賢 | D29: =IF(第1、2週上傳功課!F22="○","○",IF(第1、2週上傳功課!$F22="△","○",IF(第1、2週上傳功課!$H22="○","○",IF(第1、2週上傳功課!$H22="△","○","X")))) -> ○ | E29: =IF('莫札特小夜曲 Part 1'!E22="○","○",IF('莫札特小夜曲 Part 1'!E22="△","○",IF('莫札特小夜曲 Part 1'!E22="☆","○",IF('莫札特小夜曲 Part 1'!H22="○","○",IF('莫札特小夜曲 Part 1'!H22="☆","○",IF('莫札特小夜曲 Part 1'!H22="△","○","X")))))) -> ○ | F29: =IF('莫札特小夜曲 Part 2'!E22="○","○",IF('莫札特小夜曲 Part 2'!E22="△","○",IF('莫札特小夜曲 Part 2'!E22="☆","○",IF('莫札特小夜曲 Part 2'!H22="○","○",IF('莫札特小夜曲 Part 2'!H22="☆","○",IF('莫札特小夜曲 Part 2'!H22="△","○","X")))))) -> ○ | G29: =IF(第3、4週上傳功課!F22="○","○",IF(第3、4週上傳功課!$F22="△","○",IF(第3、4週上傳功課!$H22="○","○",IF(第3、4週上傳功課!$H22="△","○","X")))) -> ○ | H29: =IF(第5、6週上傳功課!F22="○","○",IF(第5、6週上傳功課!$F22="△","○",IF(第5、6週上傳功課!$H22="○","○",IF(第5、6週上傳功課!$H22="△","○","X")))) -> ○ | I29: =IF(第7、8週上傳功課!F22="○","○",IF(第7、8週上傳功課!$F22="△","○",IF(第7、8週上傳功課!$H22="○","○",IF(第7、8週上傳功課!$H22="△","○","X")))) -> ○ | J29: =IF(第9、10週上傳功課!F22="○","○",IF(第9、10週上傳功課!$F22="△","○",IF(第9、10週上傳功課!$H22="○","○",IF(第9、10週上傳功課!$H22="△","○","X")))) -> X | K29: =IF(Sheet4!H22="○","○",IF(Sheet4!H22="△","○",IF(Sheet4!H22="☆","○",IF(Sheet4!K22="○","○",IF(Sheet4!K22="☆","○",IF(Sheet4!K22="△","○","X")))))) -> X
A30: 18 | B30: 608 | C30: 陳靖元 | D30: =IF(第1、2週上傳功課!F23="○","○",IF(第1、2週上傳功課!$F23="△","○",IF(第1、2週上傳功課!$H23="○","○",IF(第1、2週上傳功課!$H23="△","○","X")))) -> ○ | E30: =IF('莫札特小夜曲 Part 1'!E23="○","○",IF('莫札特小夜曲 Part 1'!E23="△","○",IF('莫札特小夜曲 Part 1'!E23="☆","○",IF('莫札特小夜曲 Part 1'!H23="○","○",IF('莫札特小夜曲 Part 1'!H23="☆","○",IF('莫札特小夜曲 Part 1'!H23="△","○","X")))))) -> ○ | F30: =IF('莫札特小夜曲 Part 2'!E23="○","○",IF('莫札特小夜曲 Part 2'!E23="△","○",IF('莫札特小夜曲 Part 2'!E23="☆","○",IF('莫札特小夜曲 Part 2'!H23="○","○",IF('莫札特小夜曲 Part 2'!H23="☆","○",IF('莫札特小夜曲 Part 2'!H23="△","○","X")))))) -> ○ | G30: =IF(第3、4週上傳功課!F23="○","○",IF(第3、4週上傳功課!$F23="△","○",IF(第3、4週上傳功課!$H23="○","○",IF(第3、4週上傳功課!$H23="△","○","X")))) -> ○ | H30: =IF(第5、6週上傳功課!F23="○","○",IF(第5、6週上傳功課!$F23="△","○",IF(第5、6週上傳功課!$H23="○","○",IF(第5、6週上傳功課!$H23="△","○","X")))) -> ○ | I30: =IF(第7、8週上傳功課!F23="○","○",IF(第7、8週上傳功課!$F23="△","○",IF(第7、8週上傳功課!$H23="○","○",IF(第7、8週上傳功課!$H23="△","○","X")))) -> ○ | J30: =IF(第9、10週上傳功課!F23="○","○",IF(第9、10週上傳功課!$F23="△","○",IF(第9、10週上傳功課!$H23="○","○",IF(第9、10週上傳功課!$H23="△","○","X")))) -> X | K30: =IF(Sheet4!H23="○","○",IF(Sheet4!H23="△","○",IF(Sheet4!H23="☆","○",IF(Sheet4!K23="○","○",IF(Sheet4!K23="☆","○",IF(Sheet4!K23="△","○","X")))))) -> X
A31: 19 | B31: 608 | C31: 洪嘉妤 | D31: =IF(第1、2週上傳功課!F24="○","○",IF(第1、2週上傳功課!$F24="△","○",IF(第1、2週上傳功課!$H24="○","○",IF(第1、2週上傳功課!$H24="△","○","X")))) -> ○ | E31: =IF('莫札特小夜曲 Part 1'!E24="○","○",IF('莫札特小夜曲 Part 1'!E24="△","○",IF('莫札特小夜曲 Part 1'!E24="☆","○",IF('莫札特小夜曲 Part 1'!H24="○","○",IF('莫札特小夜曲 Part 1'!H24="☆","○",IF('莫札特小夜曲 Part 1'!H24="△","○","X")))))) -> ○ | F31: =IF('莫札特小夜曲 Part 2'!E24="○","○",IF('莫札特小夜曲 Part 2'!E24="△","○",IF('莫札特小夜曲 Part 2'!E24="☆","○",IF('莫札特小夜曲 Part 2'!H24="○","○",IF('莫札特小夜曲 Part 2'!H24="☆","○",IF('莫札特小夜曲 Part 2'!H24="△","○","X")))))) -> ○ | G31: =IF(第3、4週上傳功課!F24="○","○",IF(第3、4週上傳功課!$F24="△","○",IF(第3、4週上傳功課!$H24="○","○",IF(第3、4週上傳功課!$H24="△","○","X")))) -> ○ | H31: =IF(第5、6週上傳功課!F24="○","○",IF(第5、6週上傳功課!$F24="△","○",IF(第5、6週上傳功課!$H24="○","○",IF(第5、6週上傳功課!$H24="△","○","X")))) -> ○ | I31: =IF(第7、8週上傳功課!F24="○","○",IF(第7、8週上傳功課!$F24="△","○",IF(第7、8週上傳功課!$H24="○","○",IF(第7、8週上傳功課!$H24="△","○","X")))) -> ○ | J31: =IF(第9、10週上傳功課!F24="○","○",IF(第9、10週上傳功課!$F24="△","○",IF(第9、10週上傳功課!$H24="○","○",IF(第9、10週上傳功課!$H24="△","○","X")))) -> X | K31: =IF(Sheet4!H24="○","○",IF(Sheet4!H24="△","○",IF(Sheet4!H24="☆","○",IF(Sheet4!K24="○","○",IF(Sheet4!K24="☆","○",IF(Sheet4!K24="△","○","X")))))) -> X
A32: 20 | B32: 608 | C32: 王任華 | D32: =IF(第1、2週上傳功課!F25="○","○",IF(第1、2週上傳功課!$F25="△","○",IF(第1、2週上傳功課!$H25="○","○",IF(第1、2週上傳功課!$H25="△","○","X")))) -> ○ | E32: =IF('莫札特小夜曲 Part 1'!E25="○","○",IF('莫札特小夜曲 Part 1'!E25="△","○",IF('莫札特小夜曲 Part 1'!E25="☆","○",IF('莫札特小夜曲 Part 1'!H25="○","○",IF('莫札特小夜曲 Part 1'!H25="☆","○",IF('莫札特小夜曲 Part 1'!H25="△","○","X")))))) -> ○ | F32: =IF('莫札特小夜曲 Part 2'!E25="○","○",IF('莫札特小夜曲 Part 2'!E25="△","○",IF('莫札特小夜曲 Part 2'!E25="☆","○",IF('莫札特小夜曲 Part 2'!H25="○","○",IF('莫札特小夜曲 Part 2'!H25="☆","○",IF('莫札特小夜曲 Part 2'!H25="△","○","X")))))) -> ○ | G32: =IF(第3、4週上傳功課!F25="○","○",IF(第3、4週上傳功課!$F25="△","○",IF(第3、4週上傳功課!$H25="○","○",IF(第3、4週上傳功課!$H25="△","○","X")))) -> ○ | H32: =IF(第5、6週上傳功課!F25="○","○",IF(第5、6週上傳功課!$F25="△","○",IF(第5、6週上傳功課!$H25="○","○",IF(第5、6週上傳功課!$H25="△","○","X")))) -> ○ | I32: =IF(第7、8週上傳功課!F25="○","○",IF(第7、8週上傳功課!$F25="△","○",IF(第7、8週上傳功課!$H25="○","○",IF(第7、8週上傳功課!$H25="△","○","X")))) -> ○ | J32: =IF(第9、10週上傳功課!F25="○","○",IF(第9、10週上傳功課!$F25="△","○",IF(第9、10週上傳功課!$H25="○","○",IF(第9、10週上傳功課!$H25="△","○","X")))) -> X | K32: =IF(Sheet4!H25="○","○",IF(Sheet4!H25="△","○",IF(Sheet4!H25="☆","○",IF(Sheet4!K25="○","○",IF(Sheet4!K25="☆","○",IF(Sheet4!K25="△","○","X")))))) -> X
A33: 21 | B33: 608 | C33: 林思妍 | D33: =IF(第1、2週上傳功課!F26="○","○",IF(第1、2週上傳功課!$F26="△","○",IF(第1、2週上傳功課!$H26="○","○",IF(第1、2週上傳功課!$H26="△","○","X")))) -> ○ | E33: =IF('莫札特小夜曲 Part 1'!E26="○","○",IF('莫札特小夜曲 Part 1'!E26="△","○",IF('莫札特小夜曲 Part 1'!E26="☆","○",IF('莫札特小夜曲 Part 1'!H26="○","○",IF('莫札特小夜曲 Part 1'!H26="☆","○",IF('莫札特小夜曲 Part 1'!H26="△","○","X")))))) -> ○ | F33: =IF('莫札特小夜曲 Part 2'!E26="○","○",IF('莫札特小夜曲 Part 2'!E26="△","○",IF('莫札特小夜曲 Part 2'!E26="☆","○",IF('莫札特小夜曲 Part 2'!H26="○","○",IF('莫札特小夜曲 Part 2'!H26="☆","○",IF('莫札特小夜曲 Part 2'!H26="△","○","X")))))) -> ○ | G33: =IF(第3、4週上傳功課!F26="○","○",IF(第3、4週上傳功課!$F26="△","○",IF(第3、4週上傳功課!$H26="○","○",IF(第3、4週上傳功課!$H26="△","○","X")))) -> ○ | H33: =IF(第5、6週上傳功課!F26="○","○",IF(第5、6週上傳功課!$F26="△","○",IF(第5、6週上傳功課!$H26="○","○",IF(第5、6週上傳功課!$H26="△","○","X")))) -> ○ | I33: =IF(第7、8週上傳功課!F26="○","○",IF(第7、8週上傳功課!$F26="△","○",IF(第7、8週上傳功課!$H26="○","○",IF(第7、8週上傳功課!$H26="△","○","X")))) -> ○ | J33: =IF(第9、10週上傳功課!F26="○","○",IF(第9、10週上傳功課!$F26="△","○",IF(第9、10週上傳功課!$H26="○","○",IF(第9、10週上傳功課!$H26="△","○","X")))) -> X | K33: =IF(Sheet4!H26="○","○",IF(Sheet4!H26="△","○",IF(Sheet4!H26="☆","○",IF(Sheet4!K26="○","○",IF(Sheet4!K26="☆","○",IF(Sheet4!K26="△","○","X")))))) -> X
A34: 22 | B34: 609 | C34: 高秝崗 | D34: =IF(第1、2週上傳功課!F27="○","○",IF(第1、2週上傳功課!$F27="△","○",IF(第1、2週上傳功課!$H27="○","○",IF(第1、2週上傳功課!$H27="△","○","X")))) -> ○ | E34: =IF('莫札特小夜曲 Part 1'!E27="○","○",IF('莫札特小夜曲 Part 1'!E27="△","○",IF('莫札特小夜曲 Part 1'!E27="☆","○",IF('莫札特小夜曲 Part 1'!H27="○","○",IF('莫札特小夜曲 Part 1'!H27="☆","○",IF('莫札特小夜曲 Part 1'!H27="△","○","X")))))) -> ○ | F34: =IF('莫札特小夜曲 Part 2'!E27="○","○",IF('莫札特小夜曲 Part 2'!E27="△","○",IF('莫札特小夜曲 Part 2'!E27="☆","○",IF('莫札特小夜曲 Part 2'!H27="○","○",IF('莫札特小夜曲 Part 2'!H27="☆","○",IF('莫札特小夜曲 Part 2'!H27="△","○","X")))))) -> ○ | G34: =IF(第3、4週上傳功課!F27="○","○",IF(第3、4週上傳功課!$F27="△","○",IF(第3、4週上傳功課!$H27="○","○",IF(第3、4週上傳功課!$H27="△","○","X")))) -> ○ | H34: =IF(第5、6週上傳功課!F27="○","○",IF(第5、6週上傳功課!$F27="△","○",IF(第5、6週上傳功課!$H27="○","○",IF(第5、6週上傳功課!$H27="△","○","X")))) -> ○ | I34: =IF(第7、8週上傳功課!F27="○","○",IF(第7、8週上傳功課!$F27="△","○",IF(第7、8週上傳功課!$H27="○","○",IF(第7、8週上傳功課!$H27="△","○","X")))) -> ○ | J34: =IF(第9、10週上傳功課!F27="○","○",IF(第9、10週上傳功課!$F27="△","○",IF(第9、10週上傳功課!$H27="○","○",IF(第9、10週上傳功課!$H27="△","○","X")))) -> X | K34: =IF(Sheet4!H27="○","○",IF(Sheet4!H27="△","○",IF(Sheet4!H27="☆","○",IF(Sheet4!K27="○","○",IF(Sheet4!K27="☆","○",IF(Sheet4!K27="△","○","X")))))) -> X
A35: 23 | B35: 609 | C35: 李虹萱 | D35: =IF(第1、2週上傳功課!F28="○","○",IF(第1、2週上傳功課!$F28="△","○",IF(第1、2週上傳功課!$H28="○","○",IF(第1、2週上傳功課!$H28="△","○","X")))) -> ○ | E35: =IF('莫札特小夜曲 Part 1'!E28="○","○",IF('莫札特小夜曲 Part 1'!E28="△","○",IF('莫札特小夜曲 Part 1'!E28="☆","○",IF('莫札特小夜曲 Part 1'!H28="○","○",IF('莫札特小夜曲 Part 1'!H28="☆","○",IF('莫札特小夜曲 Part 1'!H28="△","○","X")))))) -> ○ | F35: =IF('莫札特小夜曲 Part 2'!E28="○","○",IF('莫札特小夜曲 Part 2'!E28="△","○",IF('莫札特小夜曲 Part 2'!E28="☆","○",IF('莫札特小夜曲 Part 2'!H28="○","○",IF('莫札特小夜曲 Part 2'!H28="☆","○",IF('莫札特小夜曲 Part 2'!H28="△","○","X")))))) -> ○ | G35: =IF(第3、4週上傳功課!F28="○","○",IF(第3、4週上傳功課!$F28="△","○",IF(第3、4週上傳功課!$H28="○","○",IF(第3、4週上傳功課!$H28="△","○","X")))) -> ○ | H35: =IF(第5、6週上傳功課!F28="○","○",IF(第5、6週上傳功課!$F28="△","○",IF(第5、6週上傳功課!$H28="○","○",IF(第5、6週上傳功課!$H28="△","○","X")))) -> ○ | I35: =IF(第7、8週上傳功課!F28="○","○",IF(第7、8週上傳功課!$F28="△","○",IF(第7、8週上傳功課!$H28="○","○",IF(第7、8週上傳功課!$H28="△","○","X")))) -> ○ | J35: =IF(第9、10週上傳功課!F28="○","○",IF(第9、10週上傳功課!$F28="△","○",IF(第9、10週上傳功課!$H28="○","○",IF(第9、10週上傳功課!$H28="△","○","X")))) -> X | K35: =IF(Sheet4!H28="○","○",IF(Sheet4!H28="△","○",IF(Sheet4!H28="☆","○",IF(Sheet4!K28="○","○",IF(Sheet4!K28="☆","○",IF(Sheet4!K28="△","○","X")))))) -> X
A36: 24 | B36: 609 | C36: 陳姵岑 | D36: =IF(第1、2週上傳功課!F29="○","○",IF(第1、2週上傳功課!$F29="△","○",IF(第1、2週上傳功課!$H29="○","○",IF(第1、2週上傳功課!$H29="△","○","X")))) -> ○ | E36: =IF('莫札特小夜曲 Part 1'!E29="○","○",IF('莫札特小夜曲 Part 1'!E29="△","○",IF('莫札特小夜曲 Part 1'!E29="☆","○",IF('莫札特小夜曲 Part 1'!H29="○","○",IF('莫札特小夜曲 Part 1'!H29="☆","○",IF('莫札特小夜曲 Part 1'!H29="△","○","X")))))) -> ○ | F36: =IF('莫札特小夜曲 Part 2'!E29="○","○",IF('莫札特小夜曲 Part 2'!E29="△","○",IF('莫札特小夜曲 Part 2'!E29="☆","○",IF('莫札特小夜曲 Part 2'!H29="○","○",IF('莫札特小夜曲 Part 2'!H29="☆","○",IF('莫札特小夜曲 Part 2'!H29="△","○","X")))))) -> ○ | G36: =IF(第3、4週上傳功課!F29="○","○",IF(第3、4週上傳功課!$F29="△","○",IF(第3、4週上傳功課!$H29="○","○",IF(第3、4週上傳功課!$H29="△","○","X")))) -> ○ | H36: =IF(第5、6週上傳功課!F29="○","○",IF(第5、6週上傳功課!$F29="△","○",IF(第5、6週上傳功課!$H29="○","○",IF(第5、6週上傳功課!$H29="△","○","X")))) -> ○ | I36: =IF(第7、8週上傳功課!F29="○","○",IF(第7、8週上傳功課!$F29="△","○",IF(第7、8週上傳功課!$H29="○","○",IF(第7、8週上傳功課!$H29="△","○","X")))) -> X | J36: =IF(第9、10週上傳功課!F29="○","○",IF(第9、10週上傳功課!$F29="△","○",IF(第9、10週上傳功課!$H29="○","○",IF(第9、10週上傳功課!$H29="△","○","X")))) -> X | K36: =IF(Sheet4!H29="○","○",IF(Sheet4!H29="△","○",IF(Sheet4!H29="☆","○",IF(Sheet4!K29="○","○",IF(Sheet4!K29="☆","○",IF(Sheet4!K29="△","○","X")))))) -> X
A37: 25 | B37: 611 | C37: 陳知與 | D37: =IF(第1、2週上傳功課!F30="○","○",IF(第1、2週上傳功課!$F30="△","○",IF(第1、2週上傳功課!$H30="○","○",IF(第1、2週上傳功課!$H30="△","○","X")))) -> ○ | E37: =IF('莫札特小夜曲 Part 1'!E30="○","○",IF('莫札特小夜曲 Part 1'!E30="△","○",IF('莫札特小夜曲 Part 1'!E30="☆","○",IF('莫札特小夜曲 Part 1'!H30="○","○",IF('莫札特小夜曲 Part 1'!H30="☆","○",IF('莫札特小夜曲 Part 1'!H30="△","○","X")))))) -> ○ | F37: =IF('莫札特小夜曲 Part 2'!E30="○","○",IF('莫札特小夜曲 Part 2'!E30="△","○",IF('莫札特小夜曲 Part 2'!E30="☆","○",IF('莫札特小夜曲 Part 2'!H30="○","○",IF('莫札特小夜曲 Part 2'!H30="☆","○",IF('莫札特小夜曲 Part 2'!H30="△","○","X")))))) -> ○ | G37: =IF(第3、4週上傳功課!F30="○","○",IF(第3、4週上傳功課!$F30="△","○",IF(第3、4週上傳功課!$H30="○","○",IF(第3、4週上傳功課!$H30="△","○","X")))) -> ○ | H37: =IF(第5、6週上傳功課!F30="○","○",IF(第5、6週上傳功課!$F30="△","○",IF(第5、6週上傳功課!$H30="○","○",IF(第5、6週上傳功課!$H30="△","○","X")))) -> ○ | I37: =IF(第7、8週上傳功課!F30="○","○",IF(第7、8週上傳功課!$F30="△","○",IF(第7、8週上傳功課!$H30="○","○",IF(第7、8週上傳功課!$H30="△","○","X")))) -> X | J37: =IF(第9、10週上傳功課!F30="○","○",IF(第9、10週上傳功課!$F30="△","○",IF(第9、10週上傳功課!$H30="○","○",IF(第9、10週上傳功課!$H30="△","○","X")))) -> X | K37: =IF(Sheet4!H30="○","○",IF(Sheet4!H30="△","○",IF(Sheet4!H30="☆","○",IF(Sheet4!K30="○","○",IF(Sheet4!K30="☆","○",IF(Sheet4!K30="△","○","X")))))) -> X
A38: 26 | B38: 611 | C38: 洪薇媛 | D38: =IF(第1、2週上傳功課!F31="○","○",IF(第1、2週上傳功課!$F31="△","○",IF(第1、2週上傳功課!$H31="○","○",IF(第1、2週上傳功課!$H31="△","○","X")))) -> ○ | E38: =IF('莫札特小夜曲 Part 1'!E31="○","○",IF('莫札特小夜曲 Part 1'!E31="△","○",IF('莫札特小夜曲 Part 1'!E31="☆","○",IF('莫札特小夜曲 Part 1'!H31="○","○",IF('莫札特小夜曲 Part 1'!H31="☆","○",IF('莫札特小夜曲 Part 1'!H31="△","○","X")))))) -> ○ | F38: =IF('莫札特小夜曲 Part 2'!E31="○","○",IF('莫札特小夜曲 Part 2'!E31="△","○",IF('莫札特小夜曲 Part 2'!E31="☆","○",IF('莫札特小夜曲 Part 2'!H31="○","○",IF('莫札特小夜曲 Part 2'!H31="☆","○",IF('莫札特小夜曲 Part 2'!H31="△","○","X")))))) -> ○ | G38: =IF(第3、4週上傳功課!F31="○","○",IF(第3、4週上傳功課!$F31="△","○",IF(第3、4週上傳功課!$H31="○","○",IF(第3、4週上傳功課!$H31="△","○","X")))) -> ○ | H38: =IF(第5、6週上傳功課!F31="○","○",IF(第5、6週上傳功課!$F31="△","○",IF(第5、6週上傳功課!$H31="○","○",IF(第5、6週上傳功課!$H31="△","○","X")))) -> ○ | I38: =IF(第7、8週上傳功課!F31="○","○",IF(第7、8週上傳功課!$F31="△","○",IF(第7、8週上傳功課!$H31="○","○",IF(第7、8週上傳功課!$H31="△","○","X")))) -> ○ | J38: =IF(第9、10週上傳功課!F31="○","○",IF(第9、10週上傳功課!$F31="△","○",IF(第9、10週上傳功課!$H31="○","○",IF(第9、10週上傳功課!$H31="△","○","X")))) -> X | K38: =IF(Sheet4!H31="○","○",IF(Sheet4!H31="△","○",IF(Sheet4!H31="☆","○",IF(Sheet4!K31="○","○",IF(Sheet4!K31="☆","○",IF(Sheet4!K31="△","○","X")))))) -> X
A39: 27 | B39: 611 | C39: 陳俞安 | D39: =IF(第1、2週上傳功課!F32="○","○",IF(第1、2週上傳功課!$F32="△","○",IF(第1、2週上傳功課!$H32="○","○",IF(第1、2週上傳功課!$H32="△","○","X")))) -> ○ | E39: =IF('莫札特小夜曲 Part 1'!E32="○","○",IF('莫札特小夜曲 Part 1'!E32="△","○",IF('莫札特小夜曲 Part 1'!E32="☆","○",IF('莫札特小夜曲 Part 1'!H32="○","○",IF('莫札特小夜曲 Part 1'!H32="☆","○",IF('莫札特小夜曲 Part 1'!H32="△","○","X")))))) -> ○ | F39: =IF('莫札特小夜曲 Part 2'!E32="○","○",IF('莫札特小夜曲 Part 2'!E32="△","○",IF('莫札特小夜曲 Part 2'!E32="☆","○",IF('莫札特小夜曲 Part 2'!H32="○","○",IF('莫札特小夜曲 Part 2'!H32="☆","○",IF('莫札特小夜曲 Part 2'!H32="△","○","X")))))) -> ○ | G39: =IF(第3、4週上傳功課!F32="○","○",IF(第3、4週上傳功課!$F32="△","○",IF(第3、4週上傳功課!$H32="○","○",IF(第3、4週上傳功課!$H32="△","○","X")))) -> ○ | H39: =IF(第5、6週上傳功課!F32="○","○",IF(第5、6週上傳功課!$F32="△","○",IF(第5、6週上傳功課!$H32="○","○",IF(第5、6週上傳功課!$H32="△","○","X")))) -> ○ | I39: =IF(第7、8週上傳功課!F32="○","○",IF(第7、8週上傳功課!$F32="△","○",IF(第7、8週上傳功課!$H32="○","○",IF(第7、8週上傳功課!$H32="△","○","X")))) -> ○ | J39: =IF(第9、10週上傳功課!F32="○","○",IF(第9、10週上傳功課!$F32="△","○",IF(第9、10週上傳功課!$H32="○","○",IF(第9、10週上傳功課!$H32="△","○","X")))) -> X | K39: =IF(Sheet4!H32="○","○",IF(Sheet4!H32="△","○",IF(Sheet4!H32="☆","○",IF(Sheet4!K32="○","○",IF(Sheet4!K32="☆","○",IF(Sheet4!K32="△","○","X")))))) -> X
A40: 28 | B40: 612 | C40: 彭彥綸 | D40: =IF(第1、2週上傳功課!F33="○","○",IF(第1、2週上傳功課!$F33="△","○",IF(第1、2週上傳功課!$H33="○","○",IF(第1、2週上傳功課!$H33="△","○","X")))) -> ○ | E40: =IF('莫札特小夜曲 Part 1'!E33="○","○",IF('莫札特小夜曲 Part 1'!E33="△","○",IF('莫札特小夜曲 Part 1'!E33="☆","○",IF('莫札特小夜曲 Part 1'!H33="○","○",IF('莫札特小夜曲 Part 1'!H33="☆","○",IF('莫札特小夜曲 Part 1'!H33="△","○","X")))))) -> ○ | F40: =IF('莫札特小夜曲 Part 2'!E33="○","○",IF('莫札特小夜曲 Part 2'!E33="△","○",IF('莫札特小夜曲 Part 2'!E33="☆","○",IF('莫札特小夜曲 Part 2'!H33="○","○",IF('莫札特小夜曲 Part 2'!H33="☆","○",IF('莫札特小夜曲 Part 2'!H33="△","○","X")))))) -> ○ | G40: =IF(第3、4週上傳功課!F33="○","○",IF(第3、4週上傳功課!$F33="△","○",IF(第3、4週上傳功課!$H33="○","○",IF(第3、4週上傳功課!$H33="△","○","X")))) -> ○ | H40: =IF(第5、6週上傳功課!F33="○","○",IF(第5、6週上傳功課!$F33="△","○",IF(第5、6週上傳功課!$H33="○","○",IF(第5、6週上傳功課!$H33="△","○","X")))) -> ○ | I40: =IF(第7、8週上傳功課!F33="○","○",IF(第7、8週上傳功課!$F33="△","○",IF(第7、8週上傳功課!$H33="○","○",IF(第7、8週上傳功課!$H33="△","○","X")))) -> ○ | J40: =IF(第9、10週上傳功課!F33="○","○",IF(第9、10週上傳功課!$F33="△","○",IF(第9、10週上傳功課!$H33="○","○",IF(第9、10週上傳功課!$H33="△","○","X")))) -> X | K40: =IF(Sheet4!H33="○","○",IF(Sheet4!H33="△","○",IF(Sheet4!H33="☆","○",IF(Sheet4!K33="○","○",IF(Sheet4!K33="☆","○",IF(Sheet4!K33="△","○","X")))))) -> X
A41: 29 | B41: 612 | C41: 詹景雲 | D41: =IF(第1、2週上傳功課!F34="○","○",IF(第1、2週上傳功課!$F34="△","○",IF(第1、2週上傳功課!$H34="○","○",IF(第1、2週上傳功課!$H34="△","○","X")))) -> ○ | E41: =IF('莫札特小夜曲 Part 1'!E34="○","○",IF('莫札特小夜曲 Part 1'!E34="△","○",IF('莫札特小夜曲 Part 1'!E34="☆","○",IF('莫札特小夜曲 Part 1'!H34="○","○",IF('莫札特小夜曲 Part 1'!H34="☆","○",IF('莫札特小夜曲 Part 1'!H34="△","○","X")))))) -> ○ | F41: =IF('莫札特小夜曲 Part 2'!E34="○","○",IF('莫札特小夜曲 Part 2'!E34="△","○",IF('莫札特小夜曲 Part 2'!E34="☆","○",IF('莫札特小夜曲 Part 2'!H34="○","○",IF('莫札特小夜曲 Part 2'!H34="☆","○",IF('莫札特小夜曲 Part 2'!H34="△","○","X")))))) -> ○ | G41: =IF(第3、4週上傳功課!F34="○","○",IF(第3、4週上傳功課!$F34="△","○",IF(第3、4週上傳功課!$H34="○","○",IF(第3、4週上傳功課!$H34="△","○","X")))) -> ○ | H41: =IF(第5、6週上傳功課!F34="○","○",IF(第5、6週上傳功課!$F34="△","○",IF(第5、6週上傳功課!$H34="○","○",IF(第5、6週上傳功課!$H34="△","○","X")))) -> ○ | I41: =IF(第7、8週上傳功課!F34="○","○",IF(第7、8週上傳功課!$F34="△","○",IF(第7、8週上傳功課!$H34="○","○",IF(第7、8週上傳功課!$H34="△","○","X")))) -> ○ | J41: =IF(第9、10週上傳功課!F34="○","○",IF(第9、10週上傳功課!$F34="△","○",IF(第9、10週上傳功課!$H34="○","○",IF(第9、10週上傳功課!$H34="△","○","X")))) -> X | K41: =IF(Sheet4!H34="○","○",IF(Sheet4!H34="△","○",IF(Sheet4!H34="☆","○",IF(Sheet4!K34="○","○",IF(Sheet4!K34="☆","○",IF(Sheet4!K34="△","○","X")))))) -> X
A42: 30 | B42: 612 | C42: 陳霈萱 | D42: =IF(第1、2週上傳功課!F35="○","○",IF(第1、2週上傳功課!$F35="△","○",IF(第1、2週上傳功課!$H35="○","○",IF(第1、2週上傳功課!$H35="△","○","X")))) -> ○ | E42: =IF('莫札特小夜曲 Part 1'!E35="○","○",IF('莫札特小夜曲 Part 1'!E35="△","○",IF('莫札特小夜曲 Part 1'!E35="☆","○",IF('莫札特小夜曲 Part 1'!H35="○","○",IF('莫札特小夜曲 Part 1'!H35="☆","○",IF('莫札特小夜曲 Part 1'!H35="△","○","X")))))) -> ○ | F42: =IF('莫札特小夜曲 Part 2'!E35="○","○",IF('莫札特小夜曲 Part 2'!E35="△","○",IF('莫札特小夜曲 Part 2'!E35="☆","○",IF('莫札特小夜曲 Part 2'!H35="○","○",IF('莫札特小夜曲 Part 2'!H35="☆","○",IF('莫札特小夜曲 Part 2'!H35="△","○","X")))))) -> ○ | G42: =IF(第3、4週上傳功課!F35="○","○",IF(第3、4週上傳功課!$F35="△","○",IF(第3、4週上傳功課!$H35="○","○",IF(第3、4週上傳功課!$H35="△","○","X")))) -> ○ | H42: =IF(第5、6週上傳功課!F35="○","○",IF(第5、6週上傳功課!$F35="△","○",IF(第5、6週上傳功課!$H35="○","○",IF(第5、6週上傳功課!$H35="△","○","X")))) -> ○ | I42: =IF(第7、8週上傳功課!F35="○","○",IF(第7、8週上傳功課!$F35="△","○",IF(第7、8週上傳功課!$H35="○","○",IF(第7、8週上傳功課!$H35="△","○","X")))) -> ○ | J42: =IF(第9、10週上傳功課!F35="○","○",IF(第9、10週上傳功課!$F35="△","○",IF(第9、10週上傳功課!$H35="○","○",IF(第9、10週上傳功課!$H35="△","○","X")))) -> X | K42: =IF(Sheet4!H35="○","○",IF(Sheet4!H35="△","○",IF(Sheet4!H35="☆","○",IF(Sheet4!K35="○","○",IF(Sheet4!K35="☆","○",IF(Sheet4!K35="△","○","X")))))) -> X
A43: 31 | B43: 612 | C43: 陳禹僑 | D43: =IF(第1、2週上傳功課!F36="○","○",IF(第1、2週上傳功課!$F36="△","○",IF(第1、2週上傳功課!$H36="○","○",IF(第1、2週上傳功課!$H36="△","○","X")))) -> ○ | E43: =IF('莫札特小夜曲 Part 1'!E36="○","○",IF('莫札特小夜曲 Part 1'!E36="△","○",IF('莫札特小夜曲 Part 1'!E36="☆","○",IF('莫札特小夜曲 Part 1'!H36="○","○",IF('莫札特小夜曲 Part 1'!H36="☆","○",IF('莫札特小夜曲 Part 1'!H36="△","○","X")))))) -> ○ | F43: =IF('莫札特小夜曲 Part 2'!E36="○","○",IF('莫札特小夜曲 Part 2'!E36="△","○",IF('莫札特小夜曲 Part 2'!E36="☆","○",IF('莫札特小夜曲 Part 2'!H36="○","○",IF('莫札特小夜曲 Part 2'!H36="☆","○",IF('莫札特小夜曲 Part 2'!H36="△","○","X")))))) -> ○ | G43: =IF(第3、4週上傳功課!F36="○","○",IF(第3、4週上傳功課!$F36="△","○",IF(第3、4週上傳功課!$H36="○","○",IF(第3、4週上傳功課!$H36="△","○","X")))) -> ○ | H43: =IF(第5、6週上傳功課!F36="○","○",IF(第5、6週上傳功課!$F36="△","○",IF(第5、6週上傳功課!$H36="○","○",IF(第5、6週上傳功課!$H36="△","○","X")))) -> ○ | I43: =IF(第7、8週上傳功課!F36="○","○",IF(第7、8週上傳功課!$F36="△","○",IF(第7、8週上傳功課!$H36="○","○",IF(第7、8週上傳功課!$H36="△","○","X")))) -> ○ | J43: =IF(第9、10週上傳功課!F36="○","○",IF(第9、10週上傳功課!$F36="△","○",IF(第9、10週上傳功課!$H36="○","○",IF(第9、10週上傳功課!$H36="△","○","X")))) -> X | K43: =IF(Sheet4!H36="○","○",IF(Sheet4!H36="△","○",IF(Sheet4!H36="☆","○",IF(Sheet4!K36="○","○",IF(Sheet4!K36="☆","○",IF(Sheet4!K36="△","○","X")))))) -> X
A44: 32 | B44: 613 | C44: 李昀臻 | D44: =IF(第1、2週上傳功課!F37="○","○",IF(第1、2週上傳功課!$F37="△","○",IF(第1、2週上傳功課!$H37="○","○",IF(第1、2週上傳功課!$H37="△","○","X")))) -> ○ | E44: =IF('莫札特小夜曲 Part 1'!E37="○","○",IF('莫札特小夜曲 Part 1'!E37="△","○",IF('莫札特小夜曲 Part 1'!E37="☆","○",IF('莫札特小夜曲 Part 1'!H37="○","○",IF('莫札特小夜曲 Part 1'!H37="☆","○",IF('莫札特小夜曲 Part 1'!H37="△","○","X")))))) -> ○ | F44: =IF('莫札特小夜曲 Part 2'!E37="○","○",IF('莫札特小夜曲 Part 2'!E37="△","○",IF('莫札特小夜曲 Part 2'!E37="☆","○",IF('莫札特小夜曲 Part 2'!H37="○","○",IF('莫札特小夜曲 Part 2'!H37="☆","○",IF('莫札特小夜曲 Part 2'!H37="△","○","X")))))) -> ○ | G44: =IF(第3、4週上傳功課!F37="○","○",IF(第3、4週上傳功課!$F37="△","○",IF(第3、4週上傳功課!$H37="○","○",IF(第3、4週上傳功課!$H37="△","○","X")))) -> X | H44: =IF(第5、6週上傳功課!F37="○","○",IF(第5、6週上傳功課!$F37="△","○",IF(第5、6週上傳功課!$H37="○","○",IF(第5、6週上傳功課!$H37="△","○","X")))) -> X | I44: =IF(第7、8週上傳功課!F37="○","○",IF(第7、8週上傳功課!$F37="△","○",IF(第7、8週上傳功課!$H37="○","○",IF(第7、8週上傳功課!$H37="△","○","X")))) -> X | J44: =IF(第9、10週上傳功課!F37="○","○",IF(第9、10週上傳功課!$F37="△","○",IF(第9、10週上傳功課!$H37="○","○",IF(第9、10週上傳功課!$H37="△","○","X")))) -> X | K44: =IF(Sheet4!H37="○","○",IF(Sheet4!H37="△","○",IF(Sheet4!H37="☆","○",IF(Sheet4!K37="○","○",IF(Sheet4!K37="☆","○",IF(Sheet4!K37="△","○","X")))))) -> X
A45: 33 | B45: 613 | C45: 王芝云 | D45: =IF(第1、2週上傳功課!F38="○","○",IF(第1、2週上傳功課!$F38="△","○",IF(第1、2週上傳功課!$H38="○","○",IF(第1、2週上傳功課!$H38="△","○","X")))) -> ○ | E45: =IF('莫札特小夜曲 Part 1'!E38="○","○",IF('莫札特小夜曲 Part 1'!E38="△","○",IF('莫札特小夜曲 Part 1'!E38="☆","○",IF('莫札特小夜曲 Part 1'!H38="○","○",IF('莫札特小夜曲 Part 1'!H38="☆","○",IF('莫札特小夜曲 Part 1'!H38="△","○","X")))))) -> ○ | F45: =IF('莫札特小夜曲 Part 2'!E38="○","○",IF('莫札特小夜曲 Part 2'!E38="△","○",IF('莫札特小夜曲 Part 2'!E38="☆","○",IF('莫札特小夜曲 Part 2'!H38="○","○",IF('莫札特小夜曲 Part 2'!H38="☆","○",IF('莫札特小夜曲 Part 2'!H38="△","○","X")))))) -> ○ | G45: =IF(第3、4週上傳功課!F38="○","○",IF(第3、4週上傳功課!$F38="△","○",IF(第3、4週上傳功課!$H38="○","○",IF(第3、4週上傳功課!$H38="△","○","X")))) -> ○ | H45: =IF(第5、6週上傳功課!F38="○","○",IF(第5、6週上傳功課!$F38="△","○",IF(第5、6週上傳功課!$H38="○","○",IF(第5、6週上傳功課!$H38="△","○","X")))) -> ○ | I45: =IF(第7、8週上傳功課!F38="○","○",IF(第7、8週上傳功課!$F38="△","○",IF(第7、8週上傳功課!$H38="○","○",IF(第7、8週上傳功課!$H38="△","○","X")))) -> X | J45: =IF(第9、10週上傳功課!F38="○","○",IF(第9、10週上傳功課!$F38="△","○",IF(第9、10週上傳功課!$H38="○","○",IF(第9、10週上傳功課!$H38="△","○","X")))) -> X | K45: =IF(Sheet4!H38="○","○",IF(Sheet4!H38="△","○",IF(Sheet4!H38="☆","○",IF(Sheet4!K38="○","○",IF(Sheet4!K38="☆","○",IF(Sheet4!K38="△","○","X")))))) -> X
A46: 34 | B46: 614 | C46: 詹舒宇 | D46: =IF(第1、2週上傳功課!F39="○","○",IF(第1、2週上傳功課!$F39="△","○",IF(第1、2週上傳功課!$H39="○","○",IF(第1、2週上傳功課!$H39="△","○","X")))) -> ○ | E46: =IF('莫札特小夜曲 Part 1'!E39="○","○",IF('莫札特小夜曲 Part 1'!E39="△","○",IF('莫札特小夜曲 Part 1'!E39="☆","○",IF('莫札特小夜曲 Part 1'!H39="○","○",IF('莫札特小夜曲 Part 1'!H39="☆","○",IF('莫札特小夜曲 Part 1'!H39="△","○","X")))))) -> ○ | F46: =IF('莫札特小夜曲 Part 2'!E39="○","○",IF('莫札特小夜曲 Part 2'!E39="△","○",IF('莫札特小夜曲 Part 2'!E39="☆","○",IF('莫札特小夜曲 Part 2'!H39="○","○",IF('莫札特小夜曲 Part 2'!H39="☆","○",IF('莫札特小夜曲 Part 2'!H39="△","○","X")))))) -> ○ | G46: =IF(第3、4週上傳功課!F39="○","○",IF(第3、4週上傳功課!$F39="△","○",IF(第3、4週上傳功課!$H39="○","○",IF(第3、4週上傳功課!$H39="△","○","X")))) -> ○ | H46: =IF(第5、6週上傳功課!F39="○","○",IF(第5、6週上傳功課!$F39="△","○",IF(第5、6週上傳功課!$H39="○","○",IF(第5、6週上傳功課!$H39="△","○","X")))) -> ○ | I46: =IF(第7、8週上傳功課!F39="○","○",IF(第7、8週上傳功課!$F39="△","○",IF(第7、8週上傳功課!$H39="○","○",IF(第7、8週上傳功課!$H39="△","○","X")))) -> X | J46: =IF(第9、10週上傳功課!F39="○","○",IF(第9、10週上傳功課!$F39="△","○",IF(第9、10週上傳功課!$H39="○","○",IF(第9、10週上傳功課!$H39="△","○","X")))) -> X | K46: =IF(Sheet4!H39="○","○",IF(Sheet4!H39="△","○",IF(Sheet4!H39="☆","○",IF(Sheet4!K39="○","○",IF(Sheet4!K39="☆","○",IF(Sheet4!K39="△","○","X")))))) -> X
A47: 35 | B47: 614 | C47: 余芷岑 | D47: =IF(第1、2週上傳功課!F40="○","○",IF(第1、2週上傳功課!$F40="△","○",IF(第1、2週上傳功課!$H40="○","○",IF(第1、2週上傳功課!$H40="△","○","X")))) -> ○ | E47: =IF('莫札特小夜曲 Part 1'!E40="○","○",IF('莫札特小夜曲 Part 1'!E40="△","○",IF('莫札特小夜曲 Part 1'!E40="☆","○",IF('莫札特小夜曲 Part 1'!H40="○","○",IF('莫札特小夜曲 Part 1'!H40="☆","○",IF('莫札特小夜曲 Part 1'!H40="△","○","X")))))) -> ○ | F47: =IF('莫札特小夜曲 Part 2'!E40="○","○",IF('莫札特小夜曲 Part 2'!E40="△","○",IF('莫札特小夜曲 Part 2'!E40="☆","○",IF('莫札特小夜曲 Part 2'!H40="○","○",IF('莫札特小夜曲 Part 2'!H40="☆","○",IF('莫札特小夜曲 Part 2'!H40="△","○","X")))))) -> ○ | G47: =IF(第3、4週上傳功課!F40="○","○",IF(第3、4週上傳功課!$F40="△","○",IF(第3、4週上傳功課!$H40="○","○",IF(第3、4週上傳功課!$H40="△","○","X")))) -> ○ | H47: =IF(第5、6週上傳功課!F40="○","○",IF(第5、6週上傳功課!$F40="△","○",IF(第5、6週上傳功課!$H40="○","○",IF(第5、6週上傳功課!$H40="△","○","X")))) -> ○ | I47: =IF(第7、8週上傳功課!F40="○","○",IF(第7、8週上傳功課!$F40="△","○",IF(第7、8週上傳功課!$H40="○","○",IF(第7、8週上傳功課!$H40="△","○","X")))) -> X | J47: =IF(第9、10週上傳功課!F40="○","○",IF(第9、10週上傳功課!$F40="△","○",IF(第9、10週上傳功課!$H40="○","○",IF(第9、10週上傳功課!$H40="△","○","X")))) -> X | K47: =IF(Sheet4!H40="○","○",IF(Sheet4!H40="△","○",IF(Sheet4!H40="☆","○",IF(Sheet4!K40="○","○",IF(Sheet4!K40="☆","○",IF(Sheet4!K40="△","○","X")))))) -> X
A48: 36 | B48: 615 | C48: 陳韻婷 | D48: =IF(第1、2週上傳功課!F41="○","○",IF(第1、2週上傳功課!$F41="△","○",IF(第1、2週上傳功課!$H41="○","○",IF(第1、2週上傳功課!$H41="△","○","X")))) -> ○ | E48: =IF('莫札特小夜曲 Part 1'!E41="○","○",IF('莫札特小夜曲 Part 1'!E41="△","○",IF('莫札特小夜曲 Part 1'!E41="☆","○",IF('莫札特小夜曲 Part 1'!H41="○","○",IF('莫札特小夜曲 Part 1'!H41="☆","○",IF('莫札特小夜曲 Part 1'!H41="△","○","X")))))) -> ○ | F48: =IF('莫札特小夜曲 Part 2'!E41="○","○",IF('莫札特小夜曲 Part 2'!E41="△","○",IF('莫札特小夜曲 Part 2'!E41="☆","○",IF('莫札特小夜曲 Part 2'!H41="○","○",IF('莫札特小夜曲 Part 2'!H41="☆","○",IF('莫札特小夜曲 Part 2'!H41="△","○","X")))))) -> ○ | G48: =IF(第3、4週上傳功課!F41="○","○",IF(第3、4週上傳功課!$F41="△","○",IF(第3、4週上傳功課!$H41="○","○",IF(第3、4週上傳功課!$H41="△","○","X")))) -> ○ | H48: =IF(第5、6週上傳功課!F41="○","○",IF(第5、6週上傳功課!$F41="△","○",IF(第5、6週上傳功課!$H41="○","○",IF(第5、6週上傳功課!$H41="△","○","X")))) -> ○ | I48: =IF(第7、8週上傳功課!F41="○","○",IF(第7、8週上傳功課!$F41="△","○",IF(第7、8週上傳功課!$H41="○","○",IF(第7、8週上傳功課!$H41="△","○","X")))) -> ○ | J48: =IF(第9、10週上傳功課!F41="○","○",IF(第9、10週上傳功課!$F41="△","○",IF(第9、10週上傳功課!$H41="○","○",IF(第9、10週上傳功課!$H41="△","○","X")))) -> X | K48: =IF(Sheet4!H41="○","○",IF(Sheet4!H41="△","○",IF(Sheet4!H41="☆","○",IF(Sheet4!K41="○","○",IF(Sheet4!K41="☆","○",IF(Sheet4!K41="△","○","X")))))) -> X
A49: 37 | B49: 615 | C49: 蘇筠力 | D49: =IF(第1、2週上傳功課!F42="○","○",IF(第1、2週上傳功課!$F42="△","○",IF(第1、2週上傳功課!$H42="○","○",IF(第1、2週上傳功課!$H42="△","○","X")))) -> ○ | E49: =IF('莫札特小夜曲 Part 1'!E42="○","○",IF('莫札特小夜曲 Part 1'!E42="△","○",IF('莫札特小夜曲 Part 1'!E42="☆","○",IF('莫札特小夜曲 Part 1'!H42="○","○",IF('莫札特小夜曲 Part 1'!H42="☆","○",IF('莫札特小夜曲 Part 1'!H42="△","○","X")))))) -> ○ | F49: =IF('莫札特小夜曲 Part 2'!E42="○","○",IF('莫札特小夜曲 Part 2'!E42="△","○",IF('莫札特小夜曲 Part 2'!E42="☆","○",IF('莫札特小夜曲 Part 2'!H42="○","○",IF('莫札特小夜曲 Part 2'!H42="☆","○",IF('莫札特小夜曲 Part 2'!H42="△","○","X")))))) -> ○ | G49: =IF(第3、4週上傳功課!F42="○","○",IF(第3、4週上傳功課!$F42="△","○",IF(第3、4週上傳功課!$H42="○","○",IF(第3、4週上傳功課!$H42="△","○","X")))) -> ○ | H49: =IF(第5、6週上傳功課!F42="○","○",IF(第5、6週上傳功課!$F42="△","○",IF(第5、6週上傳功課!$H42="○","○",IF(第5、6週上傳功課!$H42="△","○","X")))) -> ○ | I49: =IF(第7、8週上傳功課!F42="○","○",IF(第7、8週上傳功課!$F42="△","○",IF(第7、8週上傳功課!$H42="○","○",IF(第7、8週上傳功課!$H42="△","○","X")))) -> ○ | J49: =IF(第9、10週上傳功課!F42="○","○",IF(第9、10週上傳功課!$F42="△","○",IF(第9、10週上傳功課!$H42="○","○",IF(第9、10週上傳功課!$H42="△","○","X")))) -> ○ | K49: =IF(Sheet4!H42="○","○",IF(Sheet4!H42="△","○",IF(Sheet4!H42="☆","○",IF(Sheet4!K42="○","○",IF(Sheet4!K42="☆","○",IF(Sheet4!K42="△","○","X")))))) -> X
A50: 38 | B50: 616 | C50: 吳宇翎 | D50: =IF(第1、2週上傳功課!F43="○","○",IF(第1、2週上傳功課!$F43="△","○",IF(第1、2週上傳功課!$H43="○","○",IF(第1、2週上傳功課!$H43="△","○","X")))) -> ○ | E50: =IF('莫札特小夜曲 Part 1'!E43="○","○",IF('莫札特小夜曲 Part 1'!E43="△","○",IF('莫札特小夜曲 Part 1'!E43="☆","○",IF('莫札特小夜曲 Part 1'!H43="○","○",IF('莫札特小夜曲 Part 1'!H43="☆","○",IF('莫札特小夜曲 Part 1'!H43="△","○","X")))))) -> ○ | F50: =IF('莫札特小夜曲 Part 2'!E43="○","○",IF('莫札特小夜曲 Part 2'!E43="△","○",IF('莫札特小夜曲 Part 2'!E43="☆","○",IF('莫札特小夜曲 Part 2'!H43="○","○",IF('莫札特小夜曲 Part 2'!H43="☆","○",IF('莫札特小夜曲 Part 2'!H43="△","○","X")))))) -> ○ | G50: =IF(第3、4週上傳功課!F43="○","○",IF(第3、4週上傳功課!$F43="△","○",IF(第3、4週上傳功課!$H43="○","○",IF(第3、4週上傳功課!$H43="△","○","X")))) -> ○ | H50: =IF(第5、6週上傳功課!F43="○","○",IF(第5、6週上傳功課!$F43="△","○",IF(第5、6週上傳功課!$H43="○","○",IF(第5、6週上傳功課!$H43="△","○","X")))) -> ○ | I50: =IF(第7、8週上傳功課!F43="○","○",IF(第7、8週上傳功課!$F43="△","○",IF(第7、8週上傳功課!$H43="○","○",IF(第7、8週上傳功課!$H43="△","○","X")))) -> ○ | J50: =IF(第9、10週上傳功課!F43="○","○",IF(第9、10週上傳功課!$F43="△","○",IF(第9、10週上傳功課!$H43="○","○",IF(第9、10週上傳功課!$H43="△","○","X")))) -> X | K50: =IF(Sheet4!H43="○","○",IF(Sheet4!H43="△","○",IF(Sheet4!H43="☆","○",IF(Sheet4!K43="○","○",IF(Sheet4!K43="☆","○",IF(Sheet4!K43="△","○","X")))))) -> X
A51: 39 | B51: 616 | C51: 蔣宥芯 | D51: =IF(第1、2週上傳功課!F44="○","○",IF(第1、2週上傳功課!$F44="△","○",IF(第1、2週上傳功課!$H44="○","○",IF(第1、2週上傳功課!$H44="△","○","X")))) -> ○ | E51: =IF('莫札特小夜曲 Part 1'!E44="○","○",IF('莫札特小夜曲 Part 1'!E44="△","○",IF('莫札特小夜曲 Part 1'!E44="☆","○",IF('莫札特小夜曲 Part 1'!H44="○","○",IF('莫札特小夜曲 Part 1'!H44="☆","○",IF('莫札特小夜曲 Part 1'!H44="△","○","X")))))) -> ○ | F51: =IF('莫札特小夜曲 Part 2'!E44="○","○",IF('莫札特小夜曲 Part 2'!E44="△","○",IF('莫札特小夜曲 Part 2'!E44="☆","○",IF('莫札特小夜曲 Part 2'!H44="○","○",IF('莫札特小夜曲 Part 2'!H44="☆","○",IF('莫札特小夜曲 Part 2'!H44="△","○","X")))))) -> ○ | G51: =IF(第3、4週上傳功課!F44="○","○",IF(第3、4週上傳功課!$F44="△","○",IF(第3、4週上傳功課!$H44="○","○",IF(第3、4週上傳功課!$H44="△","○","X")))) -> ○ | H51: =IF(第5、6週上傳功課!F44="○","○",IF(第5、6週上傳功課!$F44="△","○",IF(第5、6週上傳功課!$H44="○","○",IF(第5、6週上傳功課!$H44="△","○","X")))) -> ○ | I51: =IF(第7、8週上傳功課!F44="○","○",IF(第7、8週上傳功課!$F44="△","○",IF(第7、8週上傳功課!$H44="○","○",IF(第7、8週上傳功課!$H44="△","○","X")))) -> ○ | J51: =IF(第9、10週上傳功課!F44="○","○",IF(第9、10週上傳功課!$F44="△","○",IF(第9、10週上傳功課!$H44="○","○",IF(第9、10週上傳功課!$H44="△","○","X")))) -> X | K51: =IF(Sheet4!H44="○","○",IF(Sheet4!H44="△","○",IF(Sheet4!H44="☆","○",IF(Sheet4!K44="○","○",IF(Sheet4!K44="☆","○",IF(Sheet4!K44="△","○","X")))))) -> X
A52: 40 | B52: 616 | C52: 游湘伶 | D52: =IF(第1、2週上傳功課!F45="○","○",IF(第1、2週上傳功課!$F45="△","○",IF(第1、2週上傳功課!$H45="○","○",IF(第1、2週上傳功課!$H45="△","○","X")))) -> ○ | E52: =IF('莫札特小夜曲 Part 1'!E45="○","○",IF('莫札特小夜曲 Part 1'!E45="△","○",IF('莫札特小夜曲 Part 1'!E45="☆","○",IF('莫札特小夜曲 Part 1'!H45="○","○",IF('莫札特小夜曲 Part 1'!H45="☆","○",IF('莫札特小夜曲 Part 1'!H45="△","○","X")))))) -> ○ | F52: =IF('莫札特小夜曲 Part 2'!E45="○","○",IF('莫札特小夜曲 Part 2'!E45="△","○",IF('莫札特小夜曲 Part 2'!E45="☆","○",IF('莫札特小夜曲 Part 2'!H45="○","○",IF('莫札特小夜曲 Part 2'!H45="☆","○",IF('莫札特小夜曲 Part 2'!H45="△","○","X")))))) -> ○ | G52: =IF(第3、4週上傳功課!F45="○","○",IF(第3、4週上傳功課!$F45="△","○",IF(第3、4週上傳功課!$H45="○","○",IF(第3、4週上傳功課!$H45="△","○","X")))) -> ○ | H52: =IF(第5、6週上傳功課!F45="○","○",IF(第5、6週上傳功課!$F45="△","○",IF(第5、6週上傳功課!$H45="○","○",IF(第5、6週上傳功課!$H45="△","○","X")))) -> ○ | I52: =IF(第7、8週上傳功課!F45="○","○",IF(第7、8週上傳功課!$F45="△","○",IF(第7、8週上傳功課!$H45="○","○",IF(第7、8週上傳功課!$H45="△","○","X")))) -> ○ | J52: =IF(第9、10週上傳功課!F45="○","○",IF(第9、10週上傳功課!$F45="△","○",IF(第9、10週上傳功課!$H45="○","○",IF(第9、10週上傳功課!$H45="△","○","X")))) -> X | K52: =IF(Sheet4!H45="○","○",IF(Sheet4!H45="△","○",IF(Sheet4!H45="☆","○",IF(Sheet4!K45="○","○",IF(Sheet4!K45="☆","○",IF(Sheet4!K45="△","○","X")))))) -> X
A53: 41 | B53: 617 | C53: 張育綸 | D53: =IF(第1、2週上傳功課!F46="○","○",IF(第1、2週上傳功課!$F46="△","○",IF(第1、2週上傳功課!$H46="○","○",IF(第1、2週上傳功課!$H46="△","○","X")))) -> ○ | E53: =IF('莫札特小夜曲 Part 1'!E46="○","○",IF('莫札特小夜曲 Part 1'!E46="△","○",IF('莫札特小夜曲 Part 1'!E46="☆","○",IF('莫札特小夜曲 Part 1'!H46="○","○",IF('莫札特小夜曲 Part 1'!H46="☆","○",IF('莫札特小夜曲 Part 1'!H46="△","○","X")))))) -> ○ | F53: =IF('莫札特小夜曲 Part 2'!E46="○","○",IF('莫札特小夜曲 Part 2'!E46="△","○",IF('莫札特小夜曲 Part 2'!E46="☆","○",IF('莫札特小夜曲 Part 2'!H46="○","○",IF('莫札特小夜曲 Part 2'!H46="☆","○",IF('莫札特小夜曲 Part 2'!H46="△","○","X")))))) -> ○ | G53: =IF(第3、4週上傳功課!F46="○","○",IF(第3、4週上傳功課!$F46="△","○",IF(第3、4週上傳功課!$H46="○","○",IF(第3、4週上傳功課!$H46="△","○","X")))) -> ○ | H53: =IF(第5、6週上傳功課!F46="○","○",IF(第5、6週上傳功課!$F46="△","○",IF(第5、6週上傳功課!$H46="○","○",IF(第5、6週上傳功課!$H46="△","○","X")))) -> ○ | I53: =IF(第7、8週上傳功課!F46="○","○",IF(第7、8週上傳功課!$F46="△","○",IF(第7、8週上傳功課!$H46="○","○",IF(第7、8週上傳功課!$H46="△","○","X")))) -> ○ | J53: =IF(第9、10週上傳功課!F46="○","○",IF(第9、10週上傳功課!$F46="△","○",IF(第9、10週上傳功課!$H46="○","○",IF(第9、10週上傳功課!$H46="△","○","X")))) -> ○ | K53: =IF(Sheet4!H46="○","○",IF(Sheet4!H46="△","○",IF(Sheet4!H46="☆","○",IF(Sheet4!K46="○","○",IF(Sheet4!K46="☆","○",IF(Sheet4!K46="△","○","X")))))) -> X
A54: 42 | B54: 617 | C54: 施聿庭 | D54: =IF(第1、2週上傳功課!F47="○","○",IF(第1、2週上傳功課!$F47="△","○",IF(第1、2週上傳功課!$H47="○","○",IF(第1、2週上傳功課!$H47="△","○","X")))) -> ○ | E54: =IF('莫札特小夜曲 Part 1'!E47="○","○",IF('莫札特小夜曲 Part 1'!E47="△","○",IF('莫札特小夜曲 Part 1'!E47="☆","○",IF('莫札特小夜曲 Part 1'!H47="○","○",IF('莫札特小夜曲 Part 1'!H47="☆","○",IF('莫札特小夜曲 Part 1'!H47="△","○","X")))))) -> ○ | F54: =IF('莫札特小夜曲 Part 2'!E47="○","○",IF('莫札特小夜曲 Part 2'!E47="△","○",IF('莫札特小夜曲 Part 2'!E47="☆","○",IF('莫札特小夜曲 Part 2'!H47="○","○",IF('莫札特小夜曲 Part 2'!H47="☆","○",IF('莫札特小夜曲 Part 2'!H47="△","○","X")))))) -> ○ | G54: =IF(第3、4週上傳功課!F47="○","○",IF(第3、4週上傳功課!$F47="△","○",IF(第3、4週上傳功課!$H47="○","○",IF(第3、4週上傳功課!$H47="△","○","X")))) -> ○ | H54: =IF(第5、6週上傳功課!F47="○","○",IF(第5、6週上傳功課!$F47="△","○",IF(第5、6週上傳功課!$H47="○","○",IF(第5、6週上傳功課!$H47="△","○","X")))) -> ○ | I54: =IF(第7、8週上傳功課!F47="○","○",IF(第7、8週上傳功課!$F47="△","○",IF(第7、8週上傳功課!$H47="○","○",IF(第7、8週上傳功課!$H47="△","○","X")))) -> ○ | J54: =IF(第9、10週上傳功課!F47="○","○",IF(第9、10週上傳功課!$F47="△","○",IF(第9、10週上傳功課!$H47="○","○",IF(第9、10週上傳功課!$H47="△","○","X")))) -> X | K54: =IF(Sheet4!H47="○","○",IF(Sheet4!H47="△","○",IF(Sheet4!H47="☆","○",IF(Sheet4!K47="○","○",IF(Sheet4!K47="☆","○",IF(Sheet4!K47="△","○","X")))))) -> X
A55: 43 | B55: 617 | C55: 郭柔讌 | D55: =IF(第1、2週上傳功課!F48="○","○",IF(第1、2週上傳功課!$F48="△","○",IF(第1、2週上傳功課!$H48="○","○",IF(第1、2週上傳功課!$H48="△","○","X")))) -> ○ | E55: =IF('莫札特小夜曲 Part 1'!E48="○","○",IF('莫札特小夜曲 Part 1'!E48="△","○",IF('莫札特小夜曲 Part 1'!E48="☆","○",IF('莫札特小夜曲 Part 1'!H48="○","○",IF('莫札特小夜曲 Part 1'!H48="☆","○",IF('莫札特小夜曲 Part 1'!H48="△","○","X")))))) -> ○ | F55: =IF('莫札特小夜曲 Part 2'!E48="○","○",IF('莫札特小夜曲 Part 2'!E48="△","○",IF('莫札特小夜曲 Part 2'!E48="☆","○",IF('莫札特小夜曲 Part 2'!H48="○","○",IF('莫札特小夜曲 Part 2'!H48="☆","○",IF('莫札特小夜曲 Part 2'!H48="△","○","X")))))) -> ○ | G55: =IF(第3、4週上傳功課!F48="○","○",IF(第3、4週上傳功課!$F48="△","○",IF(第3、4週上傳功課!$H48="○","○",IF(第3、4週上傳功課!$H48="△","○","X")))) -> ○ | H55: =IF(第5、6週上傳功課!F48="○","○",IF(第5、6週上傳功課!$F48="△","○",IF(第5、6週上傳功課!$H48="○","○",IF(第5、6週上傳功課!$H48="△","○","X")))) -> ○ | I55: =IF(第7、8週上傳功課!F48="○","○",IF(第7、8週上傳功課!$F48="△","○",IF(第7、8週上傳功課!$H48="○","○",IF(第7、8週上傳功課!$H48="△","○","X")))) -> X | J55: =IF(第9、10週上傳功課!F48="○","○",IF(第9、10週上傳功課!$F48="△","○",IF(第9、10週上傳功課!$H48="○","○",IF(第9、10週上傳功課!$H48="△","○","X")))) -> X | K55: =IF(Sheet4!H48="○","○",IF(Sheet4!H48="△","○",IF(Sheet4!H48="☆","○",IF(Sheet4!K48="○","○",IF(Sheet4!K48="☆","○",IF(Sheet4!K48="△","○","X")))))) -> X
A56: 記號說明:
A57: ○ | B57: 此記號表示已經通過上傳作業.
A58: X | B58: 此記號表示尚未通過上傳作業.